M16 [Details of deaths reported with probable causes:],16.8.6,Number of Deaths due to Japanese Encephalitis (JE),TOTAL,0,0,0,0,0,NA,NA,NA,NA,NA,0,0,NA,0,NA,NA,NA,NA,NA,NA,NA,NA,NA,NA,NA,NA,NA,NA,NA,NA,NA,NA,NA,NA,NA,0,NA,0,0,0,September,2018
M1 [Ante Natal Care (ANC)],1.1,Total number of pregnant women registered for ANC,TOTAL,3804,2618,1186,1856,1948,277,277,NA,NA,277,12,12,NA,12,NA,1647,1647,NA,750,897,24,24,NA,24,NA,82,82,NA,82,NA,576,576,NA,307,269,1186,NA,1186,681,505,October,2018
M1 [Ante Natal Care (ANC)],1.1.1,"Out of the total ANC registered, number registered within 1st trimester (within 12 weeks)",TOTAL,1601,1012,589,857,744,197,197,NA,NA,197,8,8,NA,8,NA,481,481,NA,262,219,4,4,NA,4,NA,41,41,NA,41,NA,281,281,NA,142,139,589,NA,589,400,189,October,2018
M1 [Ante Natal Care (ANC)],1.2.1,Number of PW given TT1,TOTAL,1326,964,362,766,560,111,111,NA,NA,111,5,5,NA,5,NA,508,508,NA,291,217,4,4,NA,4,NA,34,34,NA,34,NA,302,302,NA,176,126,362,NA,362,256,106,October,2018
M1 [Ante Natal Care (ANC)],1.2.2,Number of PW given TT2,TOTAL,1153,873,280,753,400,95,95,NA,NA,95,5,5,NA,5,NA,414,414,NA,309,105,12,12,NA,12,NA,37,37,NA,37,NA,310,310,NA,178,132,280,NA,280,212,68,October,2018
M1 [Ante Natal Care (ANC)],1.2.3,Number of PW given TT Booster,TOTAL,157,132,25,128,29,1,1,NA,NA,1,0,0,NA,0,NA,76,76,NA,64,12,1,1,NA,1,NA,11,11,NA,11,NA,43,43,NA,27,16,25,NA,25,25,0,October,2018
M1 [Ante Natal Care (ANC)],1.2.4,Number of PW given 180 Iron Folic Acid (IFA) tablets,TOTAL,1472,1190,282,756,716,200,200,NA,NA,200,0,0,NA,0,NA,602,602,NA,268,334,5,5,NA,5,NA,56,56,NA,56,NA,327,327,NA,169,158,282,NA,282,258,24,October,2018
M1 [Ante Natal Care (ANC)],1.2.5,Number of PW given 360 Calcium tablets,TOTAL,1100,817,283,652,448,0,0,NA,NA,0,0,0,NA,0,NA,557,557,NA,223,334,5,5,NA,5,NA,56,56,NA,56,NA,199,199,NA,109,90,283,NA,283,259,24,October,2018
M1 [Ante Natal Care (ANC)],1.2.6,Number of PW given one Albendazole tablet after 1st trimester,TOTAL,740,644,96,339,401,1,1,NA,NA,1,0,0,NA,0,NA,368,368,NA,126,242,0,0,NA,0,NA,22,22,NA,22,NA,253,253,NA,119,134,96,NA,96,72,24,October,2018
M1 [Ante Natal Care (ANC)],1.2.7,Number of PW received 4 or more ANC check ups,TOTAL,1824,1601,223,468,1356,480,480,NA,NA,480,0,0,NA,0,NA,875,875,NA,135,740,5,5,NA,5,NA,38,38,NA,38,NA,203,203,NA,102,101,223,NA,223,188,35,October,2018
M1 [Ante Natal Care (ANC)],1.2.8,Number of PW given ANC Corticosteroids in Pre Term Labour,TOTAL,42,23,19,19,23,0,0,NA,NA,0,0,0,NA,0,NA,23,23,NA,0,23,0,0,NA,0,NA,NA,NA,NA,NA,NA,0,0,NA,0,0,19,NA,19,19,0,October,2018
M1 [Ante Natal Care (ANC)],1.3.1,New cases of PW with hypertension detected,TOTAL,135,111,24,22,113,30,30,NA,NA,30,0,0,NA,0,NA,80,80,NA,2,78,NA,NA,NA,NA,NA,NA,NA,NA,NA,NA,1,1,NA,0,1,24,NA,24,20,4,October,2018
M1 [Ante Natal Care (ANC)],1.3.1.a,"Out of the new cases of PW with hypertension detected, cases managed at institution",TOTAL,57,50,7,7,50,0,0,NA,NA,0,0,0,NA,0,NA,50,50,NA,0,50,NA,NA,NA,NA,NA,NA,NA,NA,NA,NA,0,0,NA,0,0,7,NA,7,7,0,October,2018
M1 [Ante Natal Care (ANC)],1.3.2,Number of Eclampsia cases managed during delivery,TOTAL,0,0,0,0,0,NA,NA,NA,NA,NA,0,0,NA,0,NA,0,0,NA,NA,0,NA,NA,NA,NA,NA,NA,NA,NA,NA,NA,0,0,NA,0,NA,0,NA,0,0,0,October,2018
M1 [Ante Natal Care (ANC)],1.4.1,Number of PW tested for Haemoglobin (Hb ) 4 or more than 4 times for respective ANCs,TOTAL,1362,1282,80,226,1136,221,221,NA,NA,221,0,0,NA,0,NA,989,989,NA,92,897,4,4,NA,4,NA,27,27,NA,27,NA,41,41,NA,23,18,80,NA,80,80,0,October,2018
M1 [Ante Natal Care (ANC)],1.4.2,Number of PW having Hb level<11 (tested cases)(7.1 to 10.9),TOTAL,798,697,101,452,346,52,52,NA,NA,52,0,0,NA,0,NA,386,386,NA,266,120,14,14,NA,14,NA,71,71,NA,71,NA,174,174,NA,0,174,101,NA,101,101,0,October,2018
M1 [Ante Natal Care (ANC)],1.4.3,Number of PW having Hb level<7 (tested cases),TOTAL,75,42,33,49,26,1,1,NA,NA,1,0,0,NA,0,NA,39,39,NA,15,24,1,1,NA,1,NA,0,0,NA,0,NA,1,1,NA,0,1,33,NA,33,33,0,October,2018
M1 [Ante Natal Care (ANC)],1.4.4,Number of PW having severe anaemia (Hb<7) treated,TOTAL,37,35,2,17,20,1,1,NA,NA,1,0,0,NA,0,NA,32,32,NA,15,17,1,1,NA,1,NA,0,0,NA,0,NA,1,1,NA,NA,1,2,NA,2,1,1,October,2018
M1 [Ante Natal Care (ANC)],1.5.1,Number of PW tested for blood sugar using OGTT (Oral Glucose Tolerance Test),TOTAL,1257,1122,135,139,1118,221,221,NA,NA,221,0,0,NA,0,NA,901,901,NA,4,897,0,0,NA,0,NA,NA,NA,NA,NA,NA,NA,NA,NA,NA,NA,135,NA,135,135,0,October,2018
M1 [Ante Natal Care (ANC)],1.5.2,Number of PW tested positive for GDM,TOTAL,61,42,19,9,52,42,42,NA,NA,42,0,0,NA,0,NA,0,0,NA,0,0,0,0,NA,0,NA,NA,NA,NA,NA,NA,NA,NA,NA,NA,NA,19,NA,19,9,10,October,2018
M1 [Ante Natal Care (ANC)],1.5.3,Number of PW given insulin out of total tested positive for GDM,TOTAL,10,9,1,1,9,9,9,NA,NA,9,0,0,NA,0,NA,0,0,NA,NA,0,0,0,NA,0,NA,NA,NA,NA,NA,NA,NA,NA,NA,NA,NA,1,NA,1,1,0,October,2018
M1 [Ante Natal Care (ANC)],1.6.1.a,Number of PW tested using POC test for Syphilis,TOTAL,0,0,NA,0,NA,NA,NA,NA,NA,NA,NA,NA,NA,NA,NA,0,0,NA,0,NA,NA,NA,NA,NA,NA,NA,NA,NA,NA,NA,NA,NA,NA,NA,NA,NA,NA,NA,NA,NA,October,2018
M1 [Ante Natal Care (ANC)],1.6.1.b,"Out of above, number of PW found sero positive for syphilis",TOTAL,0,0,NA,0,NA,NA,NA,NA,NA,NA,NA,NA,NA,NA,NA,0,0,NA,0,NA,NA,NA,NA,NA,NA,NA,NA,NA,NA,NA,NA,NA,NA,NA,NA,NA,NA,NA,NA,NA,October,2018
M1 [Ante Natal Care (ANC)],1.6.2.a,Number of pregnant women tested for Syphilis,TOTAL,1526,1438,88,340,1186,221,221,NA,NA,221,0,0,NA,0,NA,1094,1094,NA,197,897,0,0,NA,0,NA,NA,NA,NA,NA,NA,123,123,NA,55,68,88,NA,88,88,0,October,2018
M1 [Ante Natal Care (ANC)],1.6.2.b,Number of pregnant women tested found sero positive for Syphilis,TOTAL,1,1,0,1,0,0,0,NA,NA,0,0,0,NA,0,NA,1,1,NA,1,0,0,0,NA,0,NA,NA,NA,NA,NA,NA,0,0,NA,0,0,0,NA,0,0,0,October,2018
M1 [Ante Natal Care (ANC)],1.6.2.c,Number of syphilis positive pregnant women treated for Syphilis,TOTAL,0,0,0,0,0,0,0,NA,NA,0,0,0,NA,0,NA,0,0,NA,0,0,0,0,NA,0,NA,NA,NA,NA,NA,NA,0,0,NA,0,0,0,NA,0,0,0,October,2018
M1 [Ante Natal Care (ANC)],1.6.2.d,Number of babies diagnosed with Congenital Syphilis,TOTAL,0,0,0,0,0,0,0,NA,NA,0,0,0,NA,0,NA,0,0,NA,0,0,0,0,NA,0,NA,NA,NA,NA,NA,NA,0,0,NA,NA,0,0,NA,0,0,0,October,2018
M1 [Ante Natal Care (ANC)],1.6.2.e,Number of babies treated for congenital Syphilis,TOTAL,0,0,0,0,0,0,0,NA,NA,0,0,0,NA,0,NA,0,0,NA,0,0,0,0,NA,0,NA,NA,NA,NA,NA,NA,0,0,NA,NA,0,0,NA,0,0,0,October,2018
M2 [Deliveries],2.1.1.a,Number of Home Deliveries attended by Skill Birth Attendant(SBA) (Doctor/Nurse/ANM),TOTAL,1,1,NA,1,NA,NA,NA,NA,NA,NA,0,0,NA,0,NA,1,1,NA,1,NA,0,0,NA,0,NA,NA,NA,NA,NA,NA,0,0,NA,0,NA,NA,NA,NA,NA,NA,October,2018
M2 [Deliveries],2.1.1.b,Number of Home Deliveries attended by Non SBA (Trained Birth Attendant(TBA) /Relatives/etc.),TOTAL,83,83,NA,83,NA,NA,NA,NA,NA,NA,0,0,NA,0,NA,28,28,NA,28,NA,0,0,NA,0,NA,19,19,NA,19,NA,36,36,NA,36,NA,NA,NA,NA,NA,NA,October,2018
M2 [Deliveries],2.1.2,Number of PW given Tablet Misoprostol during home delivery,TOTAL,0,0,NA,0,NA,NA,NA,NA,NA,NA,0,0,NA,0,NA,0,0,NA,0,NA,NA,NA,NA,NA,NA,NA,NA,NA,NA,NA,NA,NA,NA,NA,NA,NA,NA,NA,NA,NA,October,2018
M2 [Deliveries],2.1.3,Number of newborns received 7 Home Based Newborn Care (HBNC) visits in case of Home delivery,TOTAL,46,46,NA,46,NA,NA,NA,NA,NA,NA,0,0,NA,0,NA,16,16,NA,16,NA,NA,NA,NA,NA,NA,12,12,NA,12,NA,18,18,NA,18,NA,NA,NA,NA,NA,NA,October,2018
M2 [Deliveries],2.2,Number of Institutional Deliveries conducted (Including C-Sections),TOTAL,1207,673,534,406,801,221,221,NA,NA,221,0,0,NA,0,NA,452,452,NA,0,452,NA,NA,NA,NA,NA,NA,NA,NA,NA,NA,0,0,NA,0,NA,534,NA,534,406,128,October,2018
M2 [Deliveries],2.2.1,Out of total institutional deliveries number of women discharged within 48 hours of delivery,TOTAL,636,402,234,177,459,113,113,NA,NA,113,0,0,NA,0,NA,289,289,NA,2,287,NA,NA,NA,NA,NA,NA,NA,NA,NA,NA,0,0,NA,0,NA,234,NA,234,175,59,October,2018
M2 [Deliveries],2.2.2,Number of newborns received 6 HBNC  visits after Institutional Delivery,TOTAL,804,775,29,804,NA,NA,NA,NA,NA,NA,0,0,NA,0,NA,435,435,NA,435,NA,NA,NA,NA,NA,NA,20,20,NA,20,NA,320,320,NA,320,NA,29,NA,29,29,NA,October,2018
M3 [Number of Caesarean (C-Section) deliveries],3.1,Total C -Section deliveries performed,TOTAL,344,150,194,126,218,108,108,NA,NA,108,0,0,NA,0,NA,42,42,NA,NA,42,NA,NA,NA,NA,NA,NA,NA,NA,NA,NA,NA,NA,NA,NA,NA,194,NA,194,126,68,October,2018
M3 [Number of Caesarean (C-Section) deliveries],3.1.1,"C-sections, performed at night (8 PM- 8 AM)",TOTAL,113,65,48,39,74,45,45,NA,NA,45,0,0,NA,0,NA,20,20,NA,NA,20,NA,NA,NA,NA,NA,NA,NA,NA,NA,NA,NA,NA,NA,NA,NA,48,NA,48,39,9,October,2018
M4 [Pregnancy outcome & details of new-born],4.1.1.a,Live Birth - Male,TOTAL,658,373,285,257,401,114,114,NA,NA,114,0,0,NA,0,NA,236,236,NA,13,223,0,0,NA,0,NA,9,9,NA,9,NA,14,14,NA,14,NA,285,NA,285,221,64,October,2018
M4 [Pregnancy outcome & details of new-born],4.1.1.b,Live Birth - Female,TOTAL,638,384,254,234,404,112,112,NA,NA,112,0,0,NA,0,NA,242,242,NA,17,225,0,0,NA,0,NA,10,10,NA,10,NA,20,20,NA,20,NA,254,NA,254,187,67,October,2018
M4 [Pregnancy outcome & details of new-born],4.1.2,Number of Pre term newborns ( < 37 weeks of pregnancy),TOTAL,91,58,33,17,74,31,31,NA,NA,31,0,0,NA,0,NA,21,21,NA,0,21,0,0,NA,0,NA,4,4,NA,4,NA,2,2,NA,2,NA,33,NA,33,11,22,October,2018
M4 [Pregnancy outcome & details of new-born],4.1.3,Still Birth,TOTAL,9,6,3,4,5,0,0,NA,NA,0,0,0,NA,0,NA,4,4,NA,0,4,0,0,NA,0,NA,0,0,NA,0,NA,2,2,NA,2,NA,3,NA,3,2,1,October,2018
M4 [Pregnancy outcome & details of new-born],4.2,Abortion (spontaneous),TOTAL,91,39,52,49,42,8,8,NA,NA,8,0,0,NA,0,NA,29,29,NA,0,29,0,0,NA,0,NA,2,2,NA,2,NA,0,0,NA,0,NA,52,NA,52,47,5,October,2018
M4 [Pregnancy outcome & details of new-born],4.3.1.a,MTP up to 12 weeks of pregnancy,TOTAL,149,28,121,101,48,24,24,NA,NA,24,0,0,NA,0,NA,4,4,NA,NA,4,0,0,NA,0,NA,NA,NA,NA,NA,NA,NA,NA,NA,NA,NA,121,NA,121,101,20,October,2018
M4 [Pregnancy outcome & details of new-born],4.3.1.b,MTP more than 12 weeks of pregnancy,TOTAL,15,10,5,1,14,10,10,NA,NA,10,0,0,NA,0,NA,0,0,NA,NA,0,0,0,NA,0,NA,NA,NA,NA,NA,NA,NA,NA,NA,NA,NA,5,NA,5,1,4,October,2018
M4 [Pregnancy outcome & details of new-born],4.3.2.a,Post Abortion/ MTP Complications Identified,TOTAL,0,0,0,0,0,0,0,NA,NA,0,0,0,NA,0,NA,0,0,NA,NA,0,0,0,NA,0,NA,NA,NA,NA,NA,NA,NA,NA,NA,NA,NA,0,NA,0,0,0,October,2018
M4 [Pregnancy outcome & details of new-born],4.3.2.b,Post Abortion/ MTP Complications Treated,TOTAL,0,0,0,0,0,0,0,NA,NA,0,0,0,NA,0,NA,0,0,NA,NA,0,0,0,NA,0,NA,NA,NA,NA,NA,NA,NA,NA,NA,NA,NA,0,NA,0,0,0,October,2018
M4 [Pregnancy outcome & details of new-born],4.3.3,Number of women provided with post abortion/ MTP contraception,TOTAL,71,47,24,24,47,14,14,NA,NA,14,0,0,NA,0,NA,33,33,NA,NA,33,0,0,NA,0,NA,NA,NA,NA,NA,NA,NA,NA,NA,NA,NA,24,NA,24,24,0,October,2018
M4 [Pregnancy outcome & details of new-born],4.4.1,Number of newborns weighed at birth,TOTAL,1234,735,499,429,805,226,226,NA,NA,226,0,0,NA,0,NA,468,468,NA,20,448,0,0,NA,0,NA,19,19,NA,19,NA,22,22,NA,22,NA,499,NA,499,368,131,October,2018
M4 [Pregnancy outcome & details of new-born],4.4.2,Number of newborns having weight less than 2.5 kg,TOTAL,229,167,62,42,187,59,59,NA,NA,59,0,0,NA,0,NA,105,105,NA,0,105,0,0,NA,0,NA,3,3,NA,3,NA,0,0,NA,0,NA,62,NA,62,39,23,October,2018
M4 [Pregnancy outcome & details of new-born],4.4.3,Number of Newborns breast fed within 1 hour of birth,TOTAL,961,667,294,298,663,220,220,NA,NA,220,0,0,NA,0,NA,407,407,NA,20,387,0,0,NA,0,NA,19,19,NA,19,NA,21,21,NA,21,NA,294,NA,294,238,56,October,2018
M5 [Complicated Pregnancies],5.1,"Number of cases of pregnant women with Obstetric Complications attended (Antepartum haemorrhage (APH), Post-Partum Hemorrhage (PPH), Sepsis, Eclampsia and others)",TOTAL,301,291,10,10,291,190,190,NA,NA,190,0,0,NA,0,NA,101,101,NA,0,101,NA,NA,NA,NA,NA,NA,NA,NA,NA,NA,NA,NA,NA,NA,NA,10,NA,10,10,0,October,2018
M5 [Complicated Pregnancies],5.2,Number of Complicated pregnancies treated with Blood Transfusion,TOTAL,23,21,2,2,21,4,4,NA,NA,4,NA,NA,NA,NA,NA,17,17,NA,NA,17,NA,NA,NA,NA,NA,NA,NA,NA,NA,NA,NA,NA,NA,NA,NA,2,NA,2,2,0,October,2018
M6 [Post Natal Care (PNC)],6.1,Women receiving 1st post partum checkup within 48 hours of home delivery,TOTAL,70,58,12,70,0,NA,NA,NA,NA,NA,0,0,NA,0,NA,18,18,NA,18,0,NA,NA,NA,NA,NA,19,19,NA,19,NA,21,21,NA,21,NA,12,NA,12,12,0,October,2018
M6 [Post Natal Care (PNC)],6.2,Women receiving 1st post partum checkup between 48 hours and 14 days,TOTAL,580,248,332,339,241,190,190,NA,NA,190,0,0,NA,0,NA,51,51,NA,0,51,NA,NA,NA,NA,NA,0,0,NA,0,NA,7,7,NA,7,NA,332,NA,332,332,0,October,2018
M6 [Post Natal Care (PNC)],6.3,Number of mothers provided full course of 180 IFA tablets after delivery,TOTAL,847,566,281,395,452,NA,NA,NA,NA,NA,0,0,NA,0,NA,452,452,NA,0,452,NA,NA,NA,NA,NA,17,17,NA,17,NA,97,97,NA,97,NA,281,NA,281,281,0,October,2018
M6 [Post Natal Care (PNC)],6.4,Number of mothers provided 360 Calcium tablets after delivery,TOTAL,868,587,281,416,452,NA,NA,NA,NA,NA,0,0,NA,0,NA,473,473,NA,21,452,NA,NA,NA,NA,NA,17,17,NA,17,NA,97,97,NA,97,NA,281,NA,281,281,0,October,2018
M7 [Reproductive Tract Infections/Sexually Transmitted Infections (RTI/STI) Cases],7.1.1,New RTI/STI cases identified - Male,TOTAL,115,115,0,91,24,2,2,NA,NA,2,2,2,NA,2,NA,24,24,NA,24,NA,0,0,NA,0,NA,6,6,NA,6,NA,81,81,NA,59,22,0,NA,0,0,0,October,2018
M7 [Reproductive Tract Infections/Sexually Transmitted Infections (RTI/STI) Cases],7.1.2,New RTI/STI cases identified - Female,TOTAL,332,328,4,228,104,22,22,NA,NA,22,4,4,NA,4,NA,84,84,NA,84,NA,0,0,NA,0,NA,15,15,NA,15,NA,203,203,NA,121,82,4,NA,4,4,0,October,2018
M7 [Reproductive Tract Infections/Sexually Transmitted Infections (RTI/STI) Cases],7.2.1,RTI/STI for which treatment initiated - Male,TOTAL,106,106,0,84,22,0,0,NA,NA,0,0,0,NA,0,NA,19,19,NA,19,NA,0,0,NA,0,NA,6,6,NA,6,NA,81,81,NA,59,22,0,NA,0,0,0,October,2018
M7 [Reproductive Tract Infections/Sexually Transmitted Infections (RTI/STI) Cases],7.2.2,RTI/STI for which treatment initiated -Female,TOTAL,314,310,4,210,104,22,22,NA,NA,22,2,2,NA,2,NA,68,68,NA,68,NA,0,0,NA,0,NA,15,15,NA,15,NA,203,203,NA,121,82,4,NA,4,4,0,October,2018
M8 [Family Planning],8.1.1,Number of Non Scalpel Vasectomy (NSV) / Conventional Vasectomy conducted,TOTAL,4,4,0,0,4,1,1,NA,NA,1,0,0,NA,0,NA,3,3,NA,NA,3,NA,NA,NA,NA,NA,NA,NA,NA,NA,NA,NA,NA,NA,NA,NA,0,NA,0,0,0,October,2018
M8 [Family Planning],8.2.1,Number of Laparoscopic sterilizations (excluding post abortion) conducted,TOTAL,7,6,1,0,7,6,6,NA,NA,6,0,0,NA,0,NA,0,0,NA,NA,0,NA,NA,NA,NA,NA,NA,NA,NA,NA,NA,NA,NA,NA,NA,NA,1,NA,1,0,1,October,2018
M8 [Family Planning],8.2.2,Number of Interval Mini-lap (other than post-partum and post abortion) sterilizations conducted,TOTAL,1,1,0,0,1,0,0,NA,NA,0,0,0,NA,0,NA,1,1,NA,NA,1,NA,NA,NA,NA,NA,NA,NA,NA,NA,NA,NA,NA,NA,NA,NA,0,NA,0,0,0,October,2018
M8 [Family Planning],8.2.3,Number of Postpartum sterilizations (within 7 days of delivery by minilap or concurrent with caesarean section) conducted,TOTAL,11,6,5,2,9,6,6,NA,NA,6,0,0,NA,0,NA,0,0,NA,NA,0,NA,NA,NA,NA,NA,NA,NA,NA,NA,NA,NA,NA,NA,NA,NA,5,NA,5,2,3,October,2018
M8 [Family Planning],8.2.4,Number of Post Abortion sterilizations (within 7 days of spontaneous or surgical abortion) conducted,TOTAL,15,15,0,0,15,13,13,NA,NA,13,0,0,NA,0,NA,2,2,NA,NA,2,NA,NA,NA,NA,NA,NA,NA,NA,NA,NA,NA,NA,NA,NA,NA,0,NA,0,0,0,October,2018
M8 [Family Planning],8.3,Number of Interval IUCD Insertions (excluding PPIUCD and PAIUCD),TOTAL,185,156,29,76,109,26,26,NA,NA,26,0,0,NA,0,NA,61,61,NA,46,15,NA,NA,NA,NA,NA,NA,NA,NA,NA,NA,69,69,NA,15,54,29,NA,29,15,14,October,2018
M8 [Family Planning],8.4,Number of Postpartum (within 48 hours of delivery) IUCD insertions,TOTAL,134,134,0,0,134,90,90,NA,NA,90,0,0,NA,0,NA,44,44,NA,0,44,NA,NA,NA,NA,NA,NA,NA,NA,NA,NA,0,0,NA,0,NA,0,NA,0,0,0,October,2018
M8 [Family Planning],8.5,Number of Post Abortion (within 12 days of spontaneous or surgical abortion) IUCD insertions,TOTAL,21,20,1,4,17,13,13,NA,NA,13,0,0,NA,0,NA,4,4,NA,NA,4,NA,NA,NA,NA,NA,NA,NA,NA,NA,NA,3,3,NA,3,NA,1,NA,1,1,0,October,2018
M8 [Family Planning],8.6,Number of IUCD Removals,TOTAL,70,52,18,22,48,15,15,NA,NA,15,0,0,NA,0,NA,21,21,NA,8,13,0,0,NA,0,NA,NA,NA,NA,NA,NA,16,16,NA,1,15,18,NA,18,13,5,October,2018
M8 [Family Planning],8.7,Number of complications following IUCD Insertion,TOTAL,13,13,0,13,0,0,0,NA,NA,0,3,3,NA,3,NA,10,10,NA,10,0,0,0,NA,0,NA,NA,NA,NA,NA,NA,0,0,NA,0,NA,0,NA,0,0,0,October,2018
M8 [Family Planning],8.8,Injectable Contraceptive-Antara Program- First Dose,TOTAL,87,86,1,46,41,3,3,NA,NA,3,0,0,NA,0,NA,41,41,NA,39,2,0,0,NA,0,NA,4,4,NA,4,NA,38,38,NA,2,36,1,NA,1,1,0,October,2018
M8 [Family Planning],8.9,Injectable Contraceptive-Antara Program- Second Dose,TOTAL,43,42,1,12,31,4,4,NA,NA,4,0,0,NA,0,NA,9,9,NA,9,0,0,0,NA,0,NA,1,1,NA,1,NA,28,28,NA,1,27,1,NA,1,1,0,October,2018
M8 [Family Planning],8.1,Injectable Contraceptive-Antara Program- Third Dose,TOTAL,3,2,1,1,2,0,0,NA,NA,0,0,0,NA,0,NA,2,2,NA,0,2,0,0,NA,0,NA,0,0,NA,0,NA,0,0,NA,0,0,1,NA,1,1,0,October,2018
M8 [Family Planning],8.11,Injectable Contraceptive-Antara Program- Fourth or more than fourth,TOTAL,2,2,0,0,2,1,1,NA,NA,1,0,0,NA,0,NA,1,1,NA,0,1,0,0,NA,0,NA,NA,NA,NA,NA,NA,0,0,NA,0,0,0,NA,0,0,0,October,2018
M8 [Family Planning],8.12,Number of Combined Oral Pill cycles distributed,TOTAL,899,895,4,744,155,48,48,NA,NA,48,9,9,NA,9,NA,389,389,NA,300,89,5,5,NA,5,NA,174,174,NA,174,NA,270,270,NA,252,18,4,NA,4,4,0,October,2018
M8 [Family Planning],8.13,Number of Condom pieces distributed,TOTAL,55285,55267,18,42905,12380,6000,6000,NA,NA,6000,3075,3075,NA,3075,NA,23435,23435,NA,20435,3000,1900,1900,NA,1900,NA,4372,4372,NA,4372,NA,16485,16485,NA,13105,3380,18,NA,18,18,0,October,2018
M8 [Family Planning],8.14,Number of Centchroman (weekly) pill strips distributed,TOTAL,195,195,0,179,16,0,0,NA,NA,0,0,0,NA,0,NA,109,109,NA,99,10,1,1,NA,1,NA,50,50,NA,50,NA,35,35,NA,29,6,0,NA,0,0,0,October,2018
M8 [Family Planning],8.15,Number of Emergency Contraceptive Pills (ECP) given,TOTAL,214,210,4,165,49,0,0,NA,NA,0,1,1,NA,1,NA,76,76,NA,66,10,7,7,NA,7,NA,28,28,NA,28,NA,98,98,NA,59,39,4,NA,4,4,0,October,2018
M8 [Family Planning],8.16,Number of Pregnancy Test Kits (PTK) used,TOTAL,1902,1774,128,1520,382,0,0,NA,NA,0,0,0,NA,0,NA,1206,1206,NA,921,285,0,0,NA,0,NA,68,68,NA,68,NA,500,500,NA,418,82,128,NA,128,113,15,October,2018
M8 [Family Planning],8.17.1,Complications following male sterilization,TOTAL,0,0,0,0,0,0,0,NA,NA,0,0,0,NA,0,NA,0,0,NA,0,0,0,0,NA,0,NA,NA,NA,NA,NA,NA,NA,NA,NA,NA,NA,0,NA,0,0,0,October,2018
M8 [Family Planning],8.17.2,Complications following female sterilization,TOTAL,0,0,0,0,0,0,0,NA,NA,0,0,0,NA,0,NA,0,0,NA,0,0,0,0,NA,0,NA,NA,NA,NA,NA,NA,NA,NA,NA,NA,NA,0,NA,0,0,0,October,2018
M8 [Family Planning],8.17.3,Failures following male sterilization,TOTAL,0,0,0,0,0,0,0,NA,NA,0,0,0,NA,0,NA,0,0,NA,NA,0,0,0,NA,0,NA,NA,NA,NA,NA,NA,NA,NA,NA,NA,NA,0,NA,0,0,0,October,2018
M8 [Family Planning],8.17.4,Failures following female sterilization,TOTAL,0,0,0,0,0,0,0,NA,NA,0,0,0,NA,0,NA,0,0,NA,NA,0,0,0,NA,0,NA,NA,NA,NA,NA,NA,NA,NA,NA,NA,NA,0,NA,0,0,0,October,2018
M8 [Family Planning],8.17.5,Deaths following male sterilization,TOTAL,0,0,0,0,0,0,0,NA,NA,0,0,0,NA,0,NA,0,0,NA,NA,0,0,0,NA,0,NA,NA,NA,NA,NA,NA,NA,NA,NA,NA,NA,0,NA,0,0,0,October,2018
M8 [Family Planning],8.17.6,Deaths following female sterilization,TOTAL,0,0,0,0,0,0,0,NA,NA,0,0,0,NA,0,NA,0,0,NA,NA,0,0,0,NA,0,NA,NA,NA,NA,NA,NA,NA,NA,NA,NA,NA,0,NA,0,0,0,October,2018
M9 [CHILD IMMUNISATION],9.1.1,Child immunisation - Vitamin K1 (Birth Dose),TOTAL,828,448,380,380,448,NA,NA,NA,NA,NA,0,0,NA,0,NA,448,448,NA,0,448,0,0,NA,0,NA,0,0,NA,0,NA,0,0,NA,0,0,380,NA,380,380,0,October,2018
M9 [CHILD IMMUNISATION],9.1.2,Child immunisation - BCG,TOTAL,1402,911,491,511,891,234,234,NA,NA,234,0,0,NA,0,NA,550,550,NA,80,470,0,0,NA,0,NA,26,26,NA,26,NA,101,101,NA,45,56,491,NA,491,360,131,October,2018
M9 [CHILD IMMUNISATION],9.1.3,Child immunisation - DPT1,TOTAL,129,9,120,113,16,1,1,NA,NA,1,1,1,NA,1,NA,4,4,NA,2,2,1,1,NA,1,NA,0,0,NA,0,NA,2,2,NA,2,0,120,NA,120,107,13,October,2018
M9 [CHILD IMMUNISATION],9.1.4,Child immunisation - DPT2,TOTAL,71,11,60,65,6,0,0,NA,NA,0,2,2,NA,2,NA,5,5,NA,5,0,3,3,NA,3,NA,1,1,NA,1,NA,0,0,NA,0,0,60,NA,60,54,6,October,2018
M9 [CHILD IMMUNISATION],9.1.5,Child immunisation - DPT3,TOTAL,56,6,50,50,6,0,0,NA,NA,0,0,0,NA,0,NA,1,1,NA,0,1,1,1,NA,1,NA,0,0,NA,0,NA,4,4,NA,1,3,50,NA,50,48,2,October,2018
M9 [CHILD IMMUNISATION],9.1.6,Child immunisation - Pentavalent 1,TOTAL,1921,1725,196,1325,596,157,157,NA,NA,157,27,27,NA,27,NA,851,851,NA,680,171,5,5,NA,5,NA,98,98,NA,98,NA,587,587,NA,372,215,196,NA,196,143,53,October,2018
M9 [CHILD IMMUNISATION],9.1.7,Child immunisation - Pentavalent 2,TOTAL,1541,1434,107,1185,356,105,105,NA,NA,105,35,35,NA,35,NA,708,708,NA,618,90,6,6,NA,6,NA,67,67,NA,67,NA,513,513,NA,378,135,107,NA,107,81,26,October,2018
M9 [CHILD IMMUNISATION],9.1.8,Child immunisation - Pentavalent 3,TOTAL,1262,1173,89,987,275,77,77,NA,NA,77,26,26,NA,26,NA,611,611,NA,532,79,7,7,NA,7,NA,66,66,NA,66,NA,386,386,NA,283,103,89,NA,89,73,16,October,2018
M9 [CHILD IMMUNISATION],9.1.9,Child immunisation - OPV 0 (Birth Dose),TOTAL,1261,774,487,393,868,234,234,NA,NA,234,0,0,NA,0,NA,475,475,NA,5,470,1,1,NA,1,NA,16,16,NA,16,NA,48,48,NA,15,33,487,NA,487,356,131,October,2018
M9 [CHILD IMMUNISATION],9.1.10,Child immunisation - OPV1,TOTAL,1820,1729,91,1262,558,158,158,NA,NA,158,27,27,NA,27,NA,852,852,NA,680,172,5,5,NA,5,NA,98,98,NA,98,NA,589,589,NA,374,215,91,NA,91,78,13,October,2018
M9 [CHILD IMMUNISATION],9.1.11,Child immunisation - OPV2,TOTAL,1507,1436,71,1171,336,105,105,NA,NA,105,35,35,NA,35,NA,712,712,NA,622,90,6,6,NA,6,NA,68,68,NA,68,NA,510,510,NA,375,135,71,NA,71,65,6,October,2018
M9 [CHILD IMMUNISATION],9.1.12,Child immunisation - OPV3,TOTAL,1236,1179,57,970,266,77,77,NA,NA,77,26,26,NA,26,NA,613,613,NA,532,81,5,5,NA,5,NA,66,66,NA,66,NA,392,392,NA,286,106,57,NA,57,55,2,October,2018
M9 [CHILD IMMUNISATION],9.1.13,Child immunisation - Hepatitis-B0 (Birth Dose),TOTAL,1045,704,341,365,680,234,234,NA,NA,234,0,0,NA,0,NA,411,411,NA,1,410,0,0,NA,0,NA,11,11,NA,11,NA,48,48,NA,24,24,341,NA,341,329,12,October,2018
M9 [CHILD IMMUNISATION],9.1.14,Child immunisation - Hepatitis-B1,TOTAL,71,0,71,71,0,0,0,NA,NA,0,0,0,NA,0,NA,0,0,NA,0,0,0,0,NA,0,NA,0,0,NA,0,NA,0,0,NA,0,0,71,NA,71,71,0,October,2018
M9 [CHILD IMMUNISATION],9.1.15,Child immunisation - Hepatitis-B2,TOTAL,43,0,43,42,1,0,0,NA,NA,0,0,0,NA,0,NA,0,0,NA,0,0,0,0,NA,0,NA,0,0,NA,0,NA,0,0,NA,0,0,43,NA,43,42,1,October,2018
M9 [CHILD IMMUNISATION],9.1.16,Child immunisation - Hepatitis-B3,TOTAL,61,32,29,53,8,0,0,NA,NA,0,0,0,NA,0,NA,31,31,NA,31,0,0,0,NA,0,NA,0,0,NA,0,NA,1,1,NA,1,0,29,NA,29,21,8,October,2018
M9 [CHILD IMMUNISATION],9.1.17,Child immunisation - Inactivated Polio Vaccine 1 (IPV 1),TOTAL,1699,1606,93,1100,599,159,159,NA,NA,159,15,15,NA,15,NA,777,777,NA,605,172,4,4,NA,4,NA,75,75,NA,75,NA,576,576,NA,361,215,93,NA,93,40,53,October,2018
M9 [CHILD IMMUNISATION],9.1.18,Child immunisation - Inactivated Polio Vaccine 2 (IPV 2),TOTAL,1203,1094,109,921,282,79,79,NA,NA,79,22,22,NA,22,NA,534,534,NA,457,77,4,4,NA,4,NA,83,83,NA,83,NA,372,372,NA,272,100,109,NA,109,83,26,October,2018
M9 [CHILD IMMUNISATION],9.1.19,Child immunisation - Rotavirus 1,TOTAL,133,7,126,78,55,0,0,NA,NA,0,0,0,NA,0,NA,0,0,NA,0,0,0,0,NA,0,NA,7,7,NA,7,NA,0,0,NA,0,0,126,NA,126,71,55,October,2018
M9 [CHILD IMMUNISATION],9.1.20,Child immunisation - Rotavirus 2,TOTAL,103,0,103,75,28,0,0,NA,NA,0,0,0,NA,0,NA,0,0,NA,0,0,0,0,NA,0,NA,0,0,NA,0,NA,0,0,NA,0,0,103,NA,103,75,28,October,2018
M9 [CHILD IMMUNISATION],9.1.21,Child immunisation - Rotavirus 3,TOTAL,79,0,79,61,18,0,0,NA,NA,0,0,0,NA,0,NA,0,0,NA,0,0,0,0,NA,0,NA,0,0,NA,0,NA,0,0,NA,0,0,79,NA,79,61,18,October,2018
M9 [CHILD IMMUNISATION],9.2.1,Child immunisation (9-11months) - Measles & Rubella (MR)- 1st Dose,TOTAL,1556,1531,25,1170,386,84,84,NA,NA,84,24,24,NA,24,NA,793,793,NA,693,100,23,23,NA,23,NA,73,73,NA,73,NA,534,534,NA,332,202,25,NA,25,25,0,October,2018
M9 [CHILD IMMUNISATION],9.2.2,Child immunisation (9-11months) - Measles 1st dose,TOTAL,151,106,45,151,0,0,0,NA,NA,0,0,0,NA,0,NA,24,24,NA,24,0,0,0,NA,0,NA,0,0,NA,0,NA,82,82,NA,82,NA,45,NA,45,45,0,October,2018
M9 [CHILD IMMUNISATION],9.2.3,Child immunisation (9-11months) - JE 1st dose,TOTAL,8,0,8,0,8,0,0,NA,NA,0,0,0,NA,0,NA,0,0,NA,0,0,0,0,NA,0,NA,NA,NA,NA,NA,NA,0,0,NA,0,NA,8,NA,8,0,8,October,2018
M9 [CHILD IMMUNISATION],9.2.4.a,Children aged between 9 and 11 months fully immunized- Male,TOTAL,828,756,72,640,188,13,13,NA,NA,13,12,12,NA,12,NA,407,407,NA,358,49,5,5,NA,5,NA,41,41,NA,41,NA,278,278,NA,174,104,72,NA,72,50,22,October,2018
M9 [CHILD IMMUNISATION],9.2.4.b,Children aged between 9 and 11 months fully immunized - Female,TOTAL,799,741,58,629,170,12,12,NA,NA,12,10,10,NA,10,NA,409,409,NA,358,51,18,18,NA,18,NA,32,32,NA,32,NA,260,260,NA,171,89,58,NA,58,40,18,October,2018
M9 [CHILD IMMUNISATION],9.3.1,Child immunisation - Measles & Rubella (MR)- 1st Dose,TOTAL,32,30,2,28,4,0,0,NA,NA,0,24,24,NA,24,NA,2,2,NA,2,0,0,0,NA,0,NA,NA,NA,NA,NA,NA,4,4,NA,0,4,2,NA,2,2,0,October,2018
M9 [CHILD IMMUNISATION],9.3.2,Child immunisation - Measles-1st dose,TOTAL,0,0,0,0,0,0,0,NA,NA,0,0,0,NA,0,NA,0,0,NA,0,0,0,0,NA,0,NA,0,0,NA,0,NA,0,0,NA,0,NA,0,NA,0,0,0,October,2018
M9 [CHILD IMMUNISATION],9.3.3,Child immunisation - JE 1st dose,TOTAL,8,0,8,0,8,NA,NA,NA,NA,NA,0,0,NA,0,NA,0,0,NA,0,0,0,0,NA,0,NA,0,0,NA,0,NA,0,0,NA,0,NA,8,NA,8,0,8,October,2018
M9 [CHILD IMMUNISATION],9.4.1,Child immunisation - Measles & Rubella (MR)- 2nd Dose (16-24 months),TOTAL,16,14,2,16,0,0,0,NA,NA,0,0,0,NA,0,NA,0,0,NA,0,0,0,0,NA,0,NA,NA,NA,NA,NA,NA,14,14,NA,14,0,2,NA,2,2,0,October,2018
M9 [CHILD IMMUNISATION],9.4.2,Child immunisation - Measles 2nd dose (More than 16 months),TOTAL,44,0,44,44,0,0,0,NA,NA,0,0,0,NA,0,NA,0,0,NA,0,0,0,0,NA,0,NA,0,0,NA,0,NA,0,0,NA,0,NA,44,NA,44,44,0,October,2018
M9 [CHILD IMMUNISATION],9.4.3,Child immunisation - DPT 1st Booster,TOTAL,1359,1280,79,1134,225,53,53,NA,NA,53,19,19,NA,19,NA,639,639,NA,574,65,7,7,NA,7,NA,70,70,NA,70,NA,492,492,NA,388,104,79,NA,79,76,3,October,2018
