M15 [Laboratory Testing],15.3.4.b,Number of Male STI/RTI attendees found sero Positive for syphilis,TOTAL,10,0,10,10,0,NA,NA,NA,NA,NA,NA,NA,NA,NA,NA,0,0,NA,0,NA,NA,NA,NA,NA,NA,NA,NA,NA,NA,NA,NA,NA,NA,NA,NA,10,NA,10,10,0,March,2018
M15 [Laboratory Testing],15.3.4.c,Number of Female (Non ANC)STI/RTI attendees tested for syphilis,TOTAL,6,2,4,6,0,NA,NA,NA,NA,NA,NA,NA,NA,NA,NA,2,2,NA,2,NA,NA,NA,NA,NA,NA,NA,NA,NA,NA,NA,NA,NA,NA,NA,NA,4,NA,4,4,0,March,2018
M15 [Laboratory Testing],15.3.4.d,Number of Female (Non ANC) STI/RTI attendees found sero Positive for syphilis,TOTAL,6,0,6,6,0,NA,NA,NA,NA,NA,NA,NA,NA,NA,NA,0,0,NA,0,NA,NA,NA,NA,NA,NA,NA,NA,NA,NA,NA,NA,NA,NA,NA,NA,6,NA,6,6,0,March,2018
M15 [Laboratory Testing],15.4.1,Widal tests - Number Tested,TOTAL,579,185,394,317,262,NA,NA,NA,NA,NA,NA,NA,NA,NA,NA,185,185,NA,47,138,NA,NA,NA,NA,NA,NA,NA,NA,NA,NA,NA,NA,NA,NA,NA,394,NA,394,270,124,March,2018
M15 [Laboratory Testing],15.4.2,Widal tests - Number Positive,TOTAL,109,8,101,99,10,NA,NA,NA,NA,NA,NA,NA,NA,NA,NA,8,8,NA,8,0,NA,NA,NA,NA,NA,NA,NA,NA,NA,NA,NA,NA,NA,NA,NA,101,NA,101,91,10,March,2018
M15 [Laboratory Testing],15.5.1,Radiology - X-ray,TOTAL,24477,3423,21054,5609,18868,NA,NA,NA,NA,NA,NA,NA,NA,NA,NA,3423,3423,NA,NA,3423,NA,NA,NA,NA,NA,NA,NA,NA,NA,NA,NA,NA,NA,NA,NA,21054,NA,21054,5609,15445,March,2018
M15 [Laboratory Testing],15.5.2,Radiology - Ultrasonography (USG),TOTAL,10161,1265,8896,1229,8932,NA,NA,NA,NA,NA,NA,NA,NA,NA,NA,1265,1265,NA,NA,1265,NA,NA,NA,NA,NA,NA,NA,NA,NA,NA,NA,NA,NA,NA,NA,8896,NA,8896,1229,7667,March,2018
M16 [Details of deaths reported with probable causes:],16.1,Infant deaths within 24 hrs(1 to 23 Hrs) of birth,TOTAL,0,0,0,0,0,NA,NA,NA,NA,NA,NA,NA,NA,NA,NA,0,0,NA,NA,0,NA,NA,NA,NA,NA,NA,NA,NA,NA,NA,NA,NA,NA,NA,NA,0,NA,0,0,0,March,2018
M16 [Details of deaths reported with probable causes:],16.2.1,Infant Deaths up to 4 weeks due to Sepsis,TOTAL,0,0,0,0,0,NA,NA,NA,NA,NA,NA,NA,NA,NA,NA,0,0,NA,NA,0,NA,NA,NA,NA,NA,NA,NA,NA,NA,NA,NA,NA,NA,NA,NA,0,NA,0,0,0,March,2018
M16 [Details of deaths reported with probable causes:],16.2.2,Infant Deaths up to 4 weeks due to Asphyxia,TOTAL,0,0,0,0,0,NA,NA,NA,NA,NA,NA,NA,NA,NA,NA,0,0,NA,NA,0,NA,NA,NA,NA,NA,NA,NA,NA,NA,NA,NA,NA,NA,NA,NA,0,NA,0,0,0,March,2018
M16 [Details of deaths reported with probable causes:],16.2.3,Infant Deaths up to 4 weeks due to Other causes,TOTAL,2,1,1,1,1,NA,NA,NA,NA,NA,NA,NA,NA,NA,NA,0,0,NA,NA,0,NA,NA,NA,NA,NA,NA,NA,NA,NA,NA,1,1,NA,1,NA,1,NA,1,0,1,March,2018
M16 [Details of deaths reported with probable causes:],16.3.1,Number of Infant Deaths (1 -12 months) due to Pneumonia,TOTAL,0,0,0,0,0,NA,NA,NA,NA,NA,NA,NA,NA,NA,NA,0,0,NA,NA,0,NA,NA,NA,NA,NA,NA,NA,NA,NA,NA,NA,NA,NA,NA,NA,0,NA,0,0,NA,March,2018
M16 [Details of deaths reported with probable causes:],16.3.2,Number of Infant Deaths (1 -12 months) due to Diarrhoea,TOTAL,0,0,0,0,0,NA,NA,NA,NA,NA,NA,NA,NA,NA,NA,0,0,NA,NA,0,NA,NA,NA,NA,NA,NA,NA,NA,NA,NA,NA,NA,NA,NA,NA,0,NA,0,0,0,March,2018
M16 [Details of deaths reported with probable causes:],16.3.3,Number of Infant Deaths (1 -12 months) due to Fever related,TOTAL,0,0,0,0,0,NA,NA,NA,NA,NA,NA,NA,NA,NA,NA,0,0,NA,NA,0,NA,NA,NA,NA,NA,NA,NA,NA,NA,NA,NA,NA,NA,NA,NA,0,NA,0,0,0,March,2018
M16 [Details of deaths reported with probable causes:],16.3.4,Number of Infant Deaths (1 -12 months) due to Measles,TOTAL,0,0,0,0,0,NA,NA,NA,NA,NA,NA,NA,NA,NA,NA,0,0,NA,NA,0,NA,NA,NA,NA,NA,NA,NA,NA,NA,NA,NA,NA,NA,NA,NA,0,NA,0,0,0,March,2018
M16 [Details of deaths reported with probable causes:],16.3.5,Number of Infant Deaths (1 -12 months) due to Others,TOTAL,0,0,0,0,0,NA,NA,NA,NA,NA,NA,NA,NA,NA,NA,0,0,NA,NA,0,NA,NA,NA,NA,NA,NA,NA,NA,NA,NA,NA,NA,NA,NA,NA,0,NA,0,0,0,March,2018
M16 [Details of deaths reported with probable causes:],16.4.1,Number of Child Deaths (1 -5 years) due to Pneumonia,TOTAL,0,0,0,0,0,NA,NA,NA,NA,NA,NA,NA,NA,NA,NA,0,0,NA,NA,0,NA,NA,NA,NA,NA,NA,NA,NA,NA,NA,NA,NA,NA,NA,NA,0,NA,0,0,0,March,2018
M16 [Details of deaths reported with probable causes:],16.4.2,Number of Child Deaths (1 -5 years) due to Diarrhoea,TOTAL,0,0,0,0,0,NA,NA,NA,NA,NA,NA,NA,NA,NA,NA,0,0,NA,NA,0,NA,NA,NA,NA,NA,NA,NA,NA,NA,NA,NA,NA,NA,NA,NA,0,NA,0,0,0,March,2018
M16 [Details of deaths reported with probable causes:],16.4.3,Number of Child Deaths (1 -5 years) due to Fever related,TOTAL,0,0,0,0,0,NA,NA,NA,NA,NA,NA,NA,NA,NA,NA,0,0,NA,NA,0,NA,NA,NA,NA,NA,NA,NA,NA,NA,NA,NA,NA,NA,NA,NA,0,NA,0,0,0,March,2018
M16 [Details of deaths reported with probable causes:],16.4.4,Number of Child Deaths (1 -5 years) due to Measles,TOTAL,0,0,0,0,0,NA,NA,NA,NA,NA,NA,NA,NA,NA,NA,0,0,NA,NA,0,NA,NA,NA,NA,NA,NA,NA,NA,NA,NA,NA,NA,NA,NA,NA,0,NA,0,0,0,March,2018
M16 [Details of deaths reported with probable causes:],16.4.5,Number of Child Deaths (1 -5 years) due to Others,TOTAL,0,0,0,0,0,NA,NA,NA,NA,NA,NA,NA,NA,NA,NA,0,0,NA,NA,0,NA,NA,NA,NA,NA,NA,NA,NA,NA,NA,NA,NA,NA,NA,NA,0,NA,0,0,0,March,2018
M16 [Details of deaths reported with probable causes:],16.5.1,Number of Maternal Deaths due to Bleeding,TOTAL,0,0,0,0,0,NA,NA,NA,NA,NA,NA,NA,NA,NA,NA,0,0,NA,NA,0,NA,NA,NA,NA,NA,NA,NA,NA,NA,NA,NA,NA,NA,NA,NA,0,NA,0,0,NA,March,2018
M16 [Details of deaths reported with probable causes:],16.5.2,Number of Maternal Deaths due to High fever,TOTAL,0,0,0,0,0,NA,NA,NA,NA,NA,NA,NA,NA,NA,NA,0,0,NA,NA,0,NA,NA,NA,NA,NA,NA,NA,NA,NA,NA,NA,NA,NA,NA,NA,0,NA,0,0,0,March,2018
M16 [Details of deaths reported with probable causes:],16.5.3,Number of Maternal Deaths due to Abortion,TOTAL,0,0,0,0,0,NA,NA,NA,NA,NA,NA,NA,NA,NA,NA,0,0,NA,NA,0,NA,NA,NA,NA,NA,NA,NA,NA,NA,NA,NA,NA,NA,NA,NA,0,NA,0,0,0,March,2018
M16 [Details of deaths reported with probable causes:],16.5.4,Number of Maternal Deaths due to Obstructed/prolonged labour,TOTAL,0,0,0,0,0,NA,NA,NA,NA,NA,NA,NA,NA,NA,NA,0,0,NA,NA,0,NA,NA,NA,NA,NA,NA,NA,NA,NA,NA,NA,NA,NA,NA,NA,0,NA,0,0,0,March,2018
M16 [Details of deaths reported with probable causes:],16.5.5,Number of Maternal Deaths due to Severe hypertesnion/fits,TOTAL,0,0,0,0,0,NA,NA,NA,NA,NA,NA,NA,NA,NA,NA,0,0,NA,NA,0,NA,NA,NA,NA,NA,NA,NA,NA,NA,NA,NA,NA,NA,NA,NA,0,NA,0,0,0,March,2018
M16 [Details of deaths reported with probable causes:],16.5.6,Number of Maternal Deaths due to Other Causes (including causes not known),TOTAL,1,1,0,0,1,1,1,NA,NA,1,NA,NA,NA,NA,NA,0,0,NA,NA,0,NA,NA,NA,NA,NA,NA,NA,NA,NA,NA,NA,NA,NA,NA,NA,0,NA,0,0,0,March,2018
M16 [Details of deaths reported with probable causes:],16.6,Total Facility Based Maternal Death Reviews (FBMDR) done,TOTAL,1,1,0,0,1,1,1,NA,NA,1,NA,NA,NA,NA,NA,0,0,NA,NA,0,NA,NA,NA,NA,NA,NA,NA,NA,NA,NA,NA,NA,NA,NA,NA,0,NA,0,0,0,March,2018
M16 [Details of deaths reported with probable causes:],16.7.1,Number of Adolscent / Adult deaths due to Diarrhoeal diseases,TOTAL,0,0,0,0,0,NA,NA,NA,NA,NA,NA,NA,NA,NA,NA,0,0,NA,NA,0,NA,NA,NA,NA,NA,NA,NA,NA,NA,NA,NA,NA,NA,NA,NA,0,NA,0,0,0,March,2018
M16 [Details of deaths reported with probable causes:],16.7.2,Number of Adolscent / Adult deaths due to Tuberculosis,TOTAL,1,0,1,0,1,NA,NA,NA,NA,NA,NA,NA,NA,NA,NA,0,0,NA,NA,0,NA,NA,NA,NA,NA,NA,NA,NA,NA,NA,NA,NA,NA,NA,NA,1,NA,1,0,1,March,2018
M16 [Details of deaths reported with probable causes:],16.7.3,Number of Adolscent / Adult deaths due to Respiratory diseases including infections (other than TB),TOTAL,12,0,12,3,9,NA,NA,NA,NA,NA,NA,NA,NA,NA,NA,0,0,NA,NA,0,NA,NA,NA,NA,NA,NA,NA,NA,NA,NA,NA,NA,NA,NA,NA,12,NA,12,3,9,March,2018
M16 [Details of deaths reported with probable causes:],16.7.4,Number of Adolscent / Adult deaths due to Other Fever Related,TOTAL,0,0,0,0,0,NA,NA,NA,NA,NA,NA,NA,NA,NA,NA,0,0,NA,NA,0,NA,NA,NA,NA,NA,NA,NA,NA,NA,NA,NA,NA,NA,NA,NA,0,NA,0,0,NA,March,2018
M16 [Details of deaths reported with probable causes:],16.7.5,Number of Adolscent / Adult deaths due to HIV/AIDS,TOTAL,0,0,0,0,0,NA,NA,NA,NA,NA,NA,NA,NA,NA,NA,0,0,NA,NA,0,NA,NA,NA,NA,NA,NA,NA,NA,NA,NA,NA,NA,NA,NA,NA,0,NA,0,0,0,March,2018
M16 [Details of deaths reported with probable causes:],16.7.6,Number of Adolscent / Adult deaths due to Heart disease/Hypertension related,TOTAL,20,1,19,1,19,NA,NA,NA,NA,NA,NA,NA,NA,NA,NA,1,1,NA,NA,1,NA,NA,NA,NA,NA,NA,NA,NA,NA,NA,NA,NA,NA,NA,NA,19,NA,19,1,18,March,2018
M16 [Details of deaths reported with probable causes:],16.7.7,Number of Adolscent / Adult deaths due to Cancer,TOTAL,23,0,23,3,20,NA,NA,NA,NA,NA,NA,NA,NA,NA,NA,0,0,NA,NA,0,NA,NA,NA,NA,NA,NA,NA,NA,NA,NA,NA,NA,NA,NA,NA,23,NA,23,3,20,March,2018
M16 [Details of deaths reported with probable causes:],16.7.8,Number of Adolscent / Adult deaths due to Neurological disease including strokes,TOTAL,7,0,7,1,6,NA,NA,NA,NA,NA,NA,NA,NA,NA,NA,0,0,NA,NA,0,NA,NA,NA,NA,NA,NA,NA,NA,NA,NA,NA,NA,NA,NA,NA,7,NA,7,1,6,March,2018
M16 [Details of deaths reported with probable causes:],16.7.9,Number of Adolscent / Adult deaths due to Accidents/Burn cases,TOTAL,0,0,0,0,0,NA,NA,NA,NA,NA,NA,NA,NA,NA,NA,0,0,NA,NA,0,NA,NA,NA,NA,NA,NA,NA,NA,NA,NA,NA,NA,NA,NA,NA,0,NA,0,0,0,March,2018
M16 [Details of deaths reported with probable causes:],16.7.10,Number of Adolscent / Adult deaths due to Suicide,TOTAL,0,0,0,0,0,NA,NA,NA,NA,NA,NA,NA,NA,NA,NA,0,0,NA,NA,0,NA,NA,NA,NA,NA,NA,NA,NA,NA,NA,NA,NA,NA,NA,NA,0,NA,0,0,0,March,2018
M16 [Details of deaths reported with probable causes:],16.7.11,Number of Adolscent / Adult deaths due to Animal bites and stings,TOTAL,0,0,0,0,0,NA,NA,NA,NA,NA,NA,NA,NA,NA,NA,0,0,NA,NA,0,NA,NA,NA,NA,NA,NA,NA,NA,NA,NA,NA,NA,NA,NA,NA,0,NA,0,0,0,March,2018
M16 [Details of deaths reported with probable causes:],16.7.12,Number of Adolscent / Adult deaths due to Known Acute Disease,TOTAL,14,0,14,0,14,NA,NA,NA,NA,NA,NA,NA,NA,NA,NA,0,0,NA,NA,0,NA,NA,NA,NA,NA,NA,NA,NA,NA,NA,NA,NA,NA,NA,NA,14,NA,14,0,14,March,2018
M16 [Details of deaths reported with probable causes:],16.7.13,Number of Adolscent / Adult deaths due to Known Chronic Disease,TOTAL,13,0,13,1,12,NA,NA,NA,NA,NA,NA,NA,NA,NA,NA,0,0,NA,NA,0,NA,NA,NA,NA,NA,NA,NA,NA,NA,NA,NA,NA,NA,NA,NA,13,NA,13,1,12,March,2018
M16 [Details of deaths reported with probable causes:],16.7.14,Number of Adolscent / Adult deaths due to Causes not known,TOTAL,3,3,0,1,2,NA,NA,NA,NA,NA,NA,NA,NA,NA,NA,2,2,NA,NA,2,NA,NA,NA,NA,NA,NA,NA,NA,NA,NA,1,1,NA,1,NA,0,NA,0,0,0,March,2018
M16 [Details of deaths reported with probable causes:],16.8.1,Number of Deaths due to Malaria- Plasmodium Vivax,TOTAL,0,0,0,0,0,NA,NA,NA,NA,NA,NA,NA,NA,NA,NA,0,0,NA,NA,0,NA,NA,NA,NA,NA,NA,NA,NA,NA,NA,NA,NA,NA,NA,NA,0,NA,0,0,0,March,2018
M16 [Details of deaths reported with probable causes:],16.8.2,Number of Deaths due to Malaria- Plasmodium Falciparum,TOTAL,0,0,0,0,0,NA,NA,NA,NA,NA,NA,NA,NA,NA,NA,0,0,NA,NA,0,NA,NA,NA,NA,NA,NA,NA,NA,NA,NA,NA,NA,NA,NA,NA,0,NA,0,0,0,March,2018
M16 [Details of deaths reported with probable causes:],16.8.3,Number of Deaths due to Kala Azar,TOTAL,0,0,0,0,0,NA,NA,NA,NA,NA,NA,NA,NA,NA,NA,0,0,NA,NA,0,NA,NA,NA,NA,NA,NA,NA,NA,NA,NA,NA,NA,NA,NA,NA,0,NA,0,0,0,March,2018
M16 [Details of deaths reported with probable causes:],16.8.4,Number of Deaths due to Dengue,TOTAL,0,0,0,0,0,NA,NA,NA,NA,NA,NA,NA,NA,NA,NA,0,0,NA,NA,0,NA,NA,NA,NA,NA,NA,NA,NA,NA,NA,NA,NA,NA,NA,NA,0,NA,0,0,0,March,2018
M16 [Details of deaths reported with probable causes:],16.8.5,Number of Deaths due to Acute Encephelitis Syndrome (AES),TOTAL,0,0,0,0,0,NA,NA,NA,NA,NA,NA,NA,NA,NA,NA,0,0,NA,NA,0,NA,NA,NA,NA,NA,NA,NA,NA,NA,NA,NA,NA,NA,NA,NA,0,NA,0,0,0,March,2018
M16 [Details of deaths reported with probable causes:],16.8.6,Number of Deaths due to Japanese Encephalitis (JE),TOTAL,0,0,0,0,0,NA,NA,NA,NA,NA,NA,NA,NA,NA,NA,0,0,NA,NA,0,NA,NA,NA,NA,NA,NA,NA,NA,NA,NA,NA,NA,NA,NA,NA,0,NA,0,0,0,March,2018
M1 [Ante Natal Care (ANC)],1.1,Total number of pregnant women registered for ANC,TOTAL,4196,3132,1064,2377,1819,330,330,NA,NA,330,11,11,NA,11,NA,1979,1979,NA,882,1097,40,40,NA,40,NA,94,94,NA,94,NA,678,678,NA,295,383,1064,NA,1064,1055,9,April,2018
M1 [Ante Natal Care (ANC)],1.1.1,"Out of the total ANC registered, number registered within 1st trimester (within 12 weeks)",TOTAL,2136,1492,644,1163,973,287,287,NA,NA,287,8,8,NA,8,NA,783,783,NA,313,470,4,4,NA,4,NA,59,59,NA,59,NA,351,351,NA,140,211,644,NA,644,639,5,April,2018
M1 [Ante Natal Care (ANC)],1.2.1,Number of PW given TT1,TOTAL,1742,1458,284,1064,678,124,124,NA,NA,124,6,6,NA,6,NA,758,758,NA,437,321,17,17,NA,17,NA,83,83,NA,83,NA,470,470,NA,249,221,284,NA,284,272,12,April,2018
M1 [Ante Natal Care (ANC)],1.2.2,Number of PW given TT2,TOTAL,1331,1069,262,878,453,108,108,NA,NA,108,7,7,NA,7,NA,512,512,NA,361,151,17,17,NA,17,NA,50,50,NA,50,NA,375,375,NA,190,185,262,NA,262,253,9,April,2018
M1 [Ante Natal Care (ANC)],1.2.3,Number of PW given TT Booster,TOTAL,212,183,29,130,82,0,0,NA,NA,0,0,0,NA,0,NA,94,94,NA,54,40,2,2,NA,2,NA,18,18,NA,18,NA,69,69,NA,27,42,29,NA,29,29,0,April,2018
M1 [Ante Natal Care (ANC)],1.2.4,Number of PW given 180 Iron Folic Acid (IFA) tablets,TOTAL,1585,1209,376,765,820,232,232,NA,NA,232,0,0,NA,0,NA,732,732,NA,220,512,17,17,NA,17,NA,62,62,NA,62,NA,166,166,NA,96,70,376,NA,376,370,6,April,2018
M1 [Ante Natal Care (ANC)],1.2.5,Number of PW given 360 Calcium tablets,TOTAL,1234,862,372,688,546,0,0,NA,NA,0,0,0,NA,0,NA,680,680,NA,168,512,NA,NA,NA,NA,NA,62,62,NA,62,NA,120,120,NA,92,28,372,NA,372,366,6,April,2018
M1 [Ante Natal Care (ANC)],1.2.6,Number of PW given one Albendazole tablet after 1st trimester,TOTAL,565,517,48,237,328,4,4,NA,NA,4,0,0,NA,0,NA,332,332,NA,72,260,7,7,NA,7,NA,37,37,NA,37,NA,137,137,NA,78,59,48,NA,48,43,5,April,2018
M1 [Ante Natal Care (ANC)],1.2.7,Number of PW received 4 or more ANC check ups,TOTAL,2380,1734,646,888,1492,437,437,NA,NA,437,0,0,NA,0,NA,1149,1149,NA,169,980,5,5,NA,5,NA,31,31,NA,31,NA,112,112,NA,45,67,646,NA,646,638,8,April,2018
M1 [Ante Natal Care (ANC)],1.2.8,Number of PW given ANC Corticosteroids in Pre Term Labour,TOTAL,43,20,23,25,18,0,0,NA,NA,0,0,0,NA,0,NA,18,18,NA,0,18,2,2,NA,2,NA,0,0,NA,0,NA,0,0,NA,0,NA,23,NA,23,23,0,April,2018
M1 [Ante Natal Care (ANC)],1.3.1,New cases of PW with hypertension detected,TOTAL,114,83,31,35,79,23,23,NA,NA,23,0,0,NA,0,NA,56,56,NA,0,56,2,2,NA,2,NA,0,0,NA,0,NA,2,2,NA,2,0,31,NA,31,31,0,April,2018
M1 [Ante Natal Care (ANC)],1.3.1.a,"Out of the new cases of PW with hypertension detected, cases managed at institution",TOTAL,61,39,22,22,39,23,23,NA,NA,23,0,0,NA,0,NA,16,16,NA,0,16,NA,NA,NA,NA,NA,0,0,NA,0,NA,0,0,NA,0,NA,22,NA,22,22,0,April,2018
M1 [Ante Natal Care (ANC)],1.3.2,Number of Eclampsia cases managed during delivery,TOTAL,0,0,0,0,0,0,0,NA,NA,0,0,0,NA,0,NA,0,0,NA,NA,0,NA,NA,NA,NA,NA,NA,NA,NA,NA,NA,NA,NA,NA,NA,NA,0,NA,0,0,0,April,2018
M1 [Ante Natal Care (ANC)],1.4.1,Number of PW tested for Haemoglobin (Hb ) 4 or more than 4 times for respective ANCs,TOTAL,1712,1456,256,422,1290,178,178,NA,NA,178,0,0,NA,0,NA,1181,1181,NA,84,1097,17,17,NA,17,NA,NA,NA,NA,NA,NA,80,80,NA,65,15,256,NA,256,256,0,April,2018
M1 [Ante Natal Care (ANC)],1.4.2,Number of PW having Hb level<11 (tested cases)(7.1 to 10.9),TOTAL,866,685,181,568,298,50,50,NA,NA,50,0,0,NA,0,NA,293,293,NA,255,38,15,15,NA,15,NA,53,53,NA,53,NA,274,274,NA,65,209,181,NA,181,180,1,April,2018
M1 [Ante Natal Care (ANC)],1.4.3,Number of PW having Hb level<7 (tested cases),TOTAL,34,28,6,18,16,2,2,NA,NA,2,0,0,NA,0,NA,22,22,NA,8,14,4,4,NA,4,NA,NA,NA,NA,NA,NA,0,0,NA,0,0,6,NA,6,6,0,April,2018
M1 [Ante Natal Care (ANC)],1.4.4,Number of PW having severe anaemia (Hb<7) treated,TOTAL,27,24,3,15,12,2,2,NA,NA,2,0,0,NA,0,NA,18,18,NA,8,10,4,4,NA,4,NA,NA,NA,NA,NA,NA,0,0,NA,0,NA,3,NA,3,3,0,April,2018
M1 [Ante Natal Care (ANC)],1.5.1,Number of PW tested for blood sugar using OGTT (Oral Glucose Tolerance Test),TOTAL,1599,1275,324,324,1275,178,178,NA,NA,178,0,0,NA,0,NA,1097,1097,NA,NA,1097,NA,NA,NA,NA,NA,NA,NA,NA,NA,NA,NA,NA,NA,NA,NA,324,NA,324,324,0,April,2018
M1 [Ante Natal Care (ANC)],1.5.2,Number of PW tested positive for GDM,TOTAL,69,24,45,45,24,24,24,NA,NA,24,0,0,NA,0,NA,NA,NA,NA,NA,NA,NA,NA,NA,NA,NA,NA,NA,NA,NA,NA,NA,NA,NA,NA,NA,45,NA,45,45,0,April,2018
M1 [Ante Natal Care (ANC)],1.5.3,Number of PW given insulin out of total tested positive for GDM,TOTAL,14,6,8,8,6,6,6,NA,NA,6,0,0,NA,0,NA,NA,NA,NA,NA,NA,NA,NA,NA,NA,NA,NA,NA,NA,NA,NA,NA,NA,NA,NA,NA,8,NA,8,8,0,April,2018
M1 [Ante Natal Care (ANC)],1.6.1.a,Number of PW tested using POC test for Syphilis,TOTAL,0,0,NA,0,NA,NA,NA,NA,NA,NA,NA,NA,NA,NA,NA,0,0,NA,0,NA,NA,NA,NA,NA,NA,NA,NA,NA,NA,NA,NA,NA,NA,NA,NA,NA,NA,NA,NA,NA,April,2018
M1 [Ante Natal Care (ANC)],1.6.1.b,"Out of above, number of PW found sero positive for syphilis",TOTAL,0,0,NA,0,NA,NA,NA,NA,NA,NA,NA,NA,NA,NA,NA,0,0,NA,0,NA,NA,NA,NA,NA,NA,NA,NA,NA,NA,NA,NA,NA,NA,NA,NA,NA,NA,NA,NA,NA,April,2018
M1 [Ante Natal Care (ANC)],1.6.2.a,Number of pregnant women tested for Syphilis,TOTAL,1755,1620,135,394,1361,178,178,NA,NA,178,0,0,NA,0,NA,1356,1356,NA,259,1097,NA,NA,NA,NA,NA,NA,NA,NA,NA,NA,86,86,NA,NA,86,135,NA,135,135,0,April,2018
M1 [Ante Natal Care (ANC)],1.6.2.b,Number of pregnant women tested found sero positive for Syphilis,TOTAL,55,0,55,55,0,0,0,NA,NA,0,0,0,NA,0,NA,0,0,NA,0,NA,NA,NA,NA,NA,NA,NA,NA,NA,NA,NA,NA,NA,NA,NA,NA,55,NA,55,55,0,April,2018
M1 [Ante Natal Care (ANC)],1.6.2.c,Number of syphilis positive pregnant women treated for Syphilis,TOTAL,0,0,0,0,0,0,0,NA,NA,0,0,0,NA,0,NA,0,0,NA,0,NA,NA,NA,NA,NA,NA,NA,NA,NA,NA,NA,NA,NA,NA,NA,NA,0,NA,0,0,0,April,2018
M1 [Ante Natal Care (ANC)],1.6.2.d,Number of babies diagnosed with Congenital Syphilis,TOTAL,0,0,0,0,0,0,0,NA,NA,0,0,0,NA,0,NA,0,0,NA,0,NA,NA,NA,NA,NA,NA,NA,NA,NA,NA,NA,NA,NA,NA,NA,NA,0,NA,0,0,0,April,2018
M1 [Ante Natal Care (ANC)],1.6.2.e,Number of babies treated for congenital Syphilis,TOTAL,0,0,0,0,0,0,0,NA,NA,0,0,0,NA,0,NA,0,0,NA,0,NA,NA,NA,NA,NA,NA,NA,NA,NA,NA,NA,NA,NA,NA,NA,NA,0,NA,0,0,0,April,2018
M2 [Deliveries],2.1.1.a,Number of Home Deliveries attended by Skill Birth Attendant(SBA) (Doctor/Nurse/ANM),TOTAL,2,2,NA,2,NA,NA,NA,NA,NA,NA,0,0,NA,0,NA,2,2,NA,2,NA,NA,NA,NA,NA,NA,NA,NA,NA,NA,NA,0,0,NA,0,NA,NA,NA,NA,NA,NA,April,2018
M2 [Deliveries],2.1.1.b,Number of Home Deliveries attended by Non SBA (Trained Birth Attendant(TBA) /Relatives/etc.),TOTAL,56,56,NA,56,NA,NA,NA,NA,NA,NA,0,0,NA,0,NA,26,26,NA,26,NA,NA,NA,NA,NA,NA,9,9,NA,9,NA,21,21,NA,21,NA,NA,NA,NA,NA,NA,April,2018
M2 [Deliveries],2.1.2,Number of PW given Tablet Misoprostol during home delivery,TOTAL,2,2,NA,2,NA,NA,NA,NA,NA,NA,0,0,NA,0,NA,0,0,NA,0,NA,NA,NA,NA,NA,NA,NA,NA,NA,NA,NA,2,2,NA,2,NA,NA,NA,NA,NA,NA,April,2018
M2 [Deliveries],2.1.3,Number of newborns received 7 Home Based Newborn Care (HBNC) visits in case of Home delivery,TOTAL,38,38,NA,38,NA,NA,NA,NA,NA,NA,0,0,NA,0,NA,10,10,NA,10,NA,NA,NA,NA,NA,NA,13,13,NA,13,NA,15,15,NA,15,NA,NA,NA,NA,NA,NA,April,2018
M2 [Deliveries],2.2,Number of Institutional Deliveries conducted (Including C-Sections),TOTAL,821,440,381,375,446,178,178,NA,NA,178,0,0,NA,0,NA,262,262,NA,0,262,NA,NA,NA,NA,NA,NA,NA,NA,NA,NA,NA,NA,NA,NA,NA,381,NA,381,375,6,April,2018
M2 [Deliveries],2.2.1,Out of total institutional deliveries number of women discharged within 48 hours of delivery,TOTAL,412,263,149,149,263,75,75,NA,NA,75,0,0,NA,0,NA,188,188,NA,0,188,NA,NA,NA,NA,NA,NA,NA,NA,NA,NA,NA,NA,NA,NA,NA,149,NA,149,149,0,April,2018
M2 [Deliveries],2.2.2,Number of newborns received 6 HBNC  visits after Institutional Delivery,TOTAL,495,494,1,495,NA,NA,NA,NA,NA,NA,0,0,NA,0,NA,275,275,NA,275,NA,NA,NA,NA,NA,NA,9,9,NA,9,NA,210,210,NA,210,NA,1,NA,1,1,NA,April,2018
M3 [Number of Caesarean (C-Section) deliveries],3.1,Total C -Section deliveries performed,TOTAL,315,136,179,173,142,103,103,NA,NA,103,0,0,NA,0,NA,33,33,NA,NA,33,NA,NA,NA,NA,NA,NA,NA,NA,NA,NA,NA,NA,NA,NA,NA,179,NA,179,173,6,April,2018
M3 [Number of Caesarean (C-Section) deliveries],3.1.1,"C-sections, performed at night (8 PM- 8 AM)",TOTAL,73,48,25,25,48,38,38,NA,NA,38,0,0,NA,0,NA,10,10,NA,NA,10,NA,NA,NA,NA,NA,NA,NA,NA,NA,NA,NA,NA,NA,NA,NA,25,NA,25,25,0,April,2018
M4 [Pregnancy outcome & details of new-born],4.1.1.a,Live Birth - Male,TOTAL,451,243,208,233,218,85,85,NA,NA,85,0,0,NA,0,NA,138,138,NA,7,131,NA,NA,NA,NA,NA,4,4,NA,4,NA,16,16,NA,16,NA,208,NA,208,206,2,April,2018
M4 [Pregnancy outcome & details of new-born],4.1.1.b,Live Birth - Female,TOTAL,446,252,194,212,234,101,101,NA,NA,101,0,0,NA,0,NA,141,141,NA,12,129,NA,NA,NA,NA,NA,5,5,NA,5,NA,5,5,NA,5,NA,194,NA,194,190,4,April,2018
M4 [Pregnancy outcome & details of new-born],4.1.2,Number of Pre term newborns ( < 37 weeks of pregnancy),TOTAL,92,51,41,42,50,46,46,NA,NA,46,0,0,NA,0,NA,4,4,NA,0,4,NA,NA,NA,NA,NA,1,1,NA,1,NA,0,0,NA,0,NA,41,NA,41,41,0,April,2018
M4 [Pregnancy outcome & details of new-born],4.1.3,Still Birth,TOTAL,10,7,3,4,6,4,4,NA,NA,4,0,0,NA,0,NA,2,2,NA,0,2,NA,NA,NA,NA,NA,0,0,NA,0,NA,1,1,NA,1,NA,3,NA,3,3,0,April,2018
M4 [Pregnancy outcome & details of new-born],4.2,Abortion (spontaneous),TOTAL,90,46,44,45,45,12,12,NA,NA,12,0,0,NA,0,NA,33,33,NA,0,33,NA,NA,NA,NA,NA,1,1,NA,1,NA,0,0,NA,0,NA,44,NA,44,44,0,April,2018
M4 [Pregnancy outcome & details of new-born],4.3.1.a,MTP up to 12 weeks of pregnancy,TOTAL,147,34,113,113,34,29,29,NA,NA,29,0,0,NA,0,NA,5,5,NA,NA,5,NA,NA,NA,NA,NA,NA,NA,NA,NA,NA,NA,NA,NA,NA,NA,113,NA,113,113,0,April,2018
M4 [Pregnancy outcome & details of new-born],4.3.1.b,MTP more than 12 weeks of pregnancy,TOTAL,28,20,8,8,20,20,20,NA,NA,20,0,0,NA,0,NA,0,0,NA,NA,0,NA,NA,NA,NA,NA,NA,NA,NA,NA,NA,NA,NA,NA,NA,NA,8,NA,8,8,NA,April,2018
M4 [Pregnancy outcome & details of new-born],4.3.2.a,Post Abortion/ MTP Complications Identified,TOTAL,0,0,0,0,0,0,0,NA,NA,0,0,0,NA,0,NA,0,0,NA,NA,0,NA,NA,NA,NA,NA,NA,NA,NA,NA,NA,NA,NA,NA,NA,NA,0,NA,0,0,0,April,2018
M4 [Pregnancy outcome & details of new-born],4.3.2.b,Post Abortion/ MTP Complications Treated,TOTAL,0,0,0,0,0,0,0,NA,NA,0,0,0,NA,0,NA,0,0,NA,NA,0,NA,NA,NA,NA,NA,NA,NA,NA,NA,NA,NA,NA,NA,NA,NA,0,NA,0,0,0,April,2018
M4 [Pregnancy outcome & details of new-born],4.3.3,Number of women provided with post abortion/ MTP contraception,TOTAL,69,52,17,17,52,14,14,NA,NA,14,0,0,NA,0,NA,38,38,NA,NA,38,NA,NA,NA,NA,NA,NA,NA,NA,NA,NA,NA,NA,NA,NA,NA,17,NA,17,17,0,April,2018
M4 [Pregnancy outcome & details of new-born],4.4.1,Number of newborns weighed at birth,TOTAL,883,492,391,431,452,186,186,NA,NA,186,0,0,NA,0,NA,279,279,NA,19,260,NA,NA,NA,NA,NA,8,8,NA,8,NA,19,19,NA,19,NA,391,NA,391,385,6,April,2018
M4 [Pregnancy outcome & details of new-born],4.4.2,Number of newborns having weight less than 2.5 kg,TOTAL,169,110,59,65,104,56,56,NA,NA,56,0,0,NA,0,NA,48,48,NA,0,48,NA,NA,NA,NA,NA,3,3,NA,3,NA,3,3,NA,3,NA,59,NA,59,59,0,April,2018
M4 [Pregnancy outcome & details of new-born],4.4.3,Number of Newborns breast fed within 1 hour of birth,TOTAL,630,438,192,234,396,176,176,NA,NA,176,0,0,NA,0,NA,237,237,NA,17,220,NA,NA,NA,NA,NA,9,9,NA,9,NA,16,16,NA,16,NA,192,NA,192,192,0,April,2018
M5 [Complicated Pregnancies],5.1,"Number of cases of pregnant women with Obstetric Complications attended (Antepartum haemorrhage (APH), Post-Partum Hemorrhage (PPH), Sepsis, Eclampsia and others)",TOTAL,195,187,8,8,187,120,120,NA,NA,120,0,0,NA,0,NA,67,67,NA,NA,67,NA,NA,NA,NA,NA,NA,NA,NA,NA,NA,NA,NA,NA,NA,NA,8,NA,8,8,0,April,2018
M5 [Complicated Pregnancies],5.2,Number of Complicated pregnancies treated with Blood Transfusion,TOTAL,16,14,2,2,14,4,4,NA,NA,4,NA,NA,NA,NA,NA,10,10,NA,NA,10,NA,NA,NA,NA,NA,NA,NA,NA,NA,NA,NA,NA,NA,NA,NA,2,NA,2,2,0,April,2018
M6 [Post Natal Care (PNC)],6.1,Women receiving 1st post partum checkup within 48 hours of home delivery,TOTAL,40,40,0,40,0,0,0,NA,NA,0,0,0,NA,0,NA,19,19,NA,19,NA,NA,NA,NA,NA,NA,9,9,NA,9,NA,12,12,NA,12,0,0,NA,0,0,0,April,2018
M6 [Post Natal Care (PNC)],6.2,Women receiving 1st post partum checkup between 48 hours and 14 days,TOTAL,573,228,345,365,208,170,170,NA,NA,170,0,0,NA,0,NA,57,57,NA,19,38,NA,NA,NA,NA,NA,1,1,NA,1,NA,0,0,NA,0,0,345,NA,345,345,0,April,2018
M6 [Post Natal Care (PNC)],6.3,Number of mothers provided full course of 180 IFA tablets after delivery,TOTAL,547,358,189,243,304,0,0,NA,NA,0,0,0,NA,0,NA,264,264,NA,2,262,NA,NA,NA,NA,NA,50,50,NA,50,NA,44,44,NA,2,42,189,NA,189,189,0,April,2018
M6 [Post Natal Care (PNC)],6.4,Number of mothers provided 360 Calcium tablets after delivery,TOTAL,583,358,225,279,304,0,0,NA,NA,0,0,0,NA,0,NA,264,264,NA,2,262,NA,NA,NA,NA,NA,50,50,NA,50,NA,44,44,NA,2,42,225,NA,225,225,0,April,2018
M7 [Reproductive Tract Infections/Sexually Transmitted Infections (RTI/STI) Cases],7.1.1,New RTI/STI cases identified - Male,TOTAL,147,141,6,88,59,0,0,NA,NA,0,4,4,NA,4,NA,69,69,NA,13,56,NA,NA,NA,NA,NA,7,7,NA,7,NA,61,61,NA,58,3,6,NA,6,6,0,April,2018
M7 [Reproductive Tract Infections/Sexually Transmitted Infections (RTI/STI) Cases],7.1.2,New RTI/STI cases identified - Female,TOTAL,587,559,28,275,312,23,23,NA,NA,23,5,5,NA,5,NA,298,298,NA,103,195,NA,NA,NA,NA,NA,30,30,NA,30,NA,203,203,NA,109,94,28,NA,28,28,0,April,2018
M7 [Reproductive Tract Infections/Sexually Transmitted Infections (RTI/STI) Cases],7.2.1,RTI/STI for which treatment initiated - Male,TOTAL,74,68,6,61,13,0,0,NA,NA,0,0,0,NA,0,NA,23,23,NA,13,10,NA,NA,NA,NA,NA,7,7,NA,7,NA,38,38,NA,35,3,6,NA,6,6,0,April,2018
M7 [Reproductive Tract Infections/Sexually Transmitted Infections (RTI/STI) Cases],7.2.2,RTI/STI for which treatment initiated -Female,TOTAL,335,307,28,213,122,23,23,NA,NA,23,1,1,NA,1,NA,92,92,NA,87,5,NA,NA,NA,NA,NA,30,30,NA,30,NA,161,161,NA,67,94,28,NA,28,28,0,April,2018
M8 [Family Planning],8.1.1,Number of Non Scalpel Vasectomy (NSV) / Conventional Vasectomy conducted,TOTAL,1,1,0,0,1,0,0,NA,NA,0,0,0,NA,0,NA,1,1,NA,NA,1,NA,NA,NA,NA,NA,NA,NA,NA,NA,NA,NA,NA,NA,NA,NA,0,NA,0,0,0,April,2018
M8 [Family Planning],8.2.1,Number of Laparoscopic sterilizations (excluding post abortion) conducted,TOTAL,27,21,6,5,22,21,21,NA,NA,21,0,0,NA,0,NA,0,0,NA,NA,0,NA,NA,NA,NA,NA,NA,NA,NA,NA,NA,NA,NA,NA,NA,NA,6,NA,6,5,1,April,2018
M8 [Family Planning],8.2.2,Number of Interval Mini-lap (other than post-partum and post abortion) sterilizations conducted,TOTAL,0,0,0,0,0,0,0,NA,NA,0,0,0,NA,0,NA,0,0,NA,NA,0,NA,NA,NA,NA,NA,NA,NA,NA,NA,NA,NA,NA,NA,NA,NA,0,NA,0,0,0,April,2018
