M14 [Patient Services],14.8.7,Number of blood transfusions done,TOTAL,625,112,513,32,593,NA,NA,NA,NA,NA,0,0,NA,0,NA,112,112,NA,NA,112,NA,NA,NA,NA,NA,NA,NA,NA,NA,NA,NA,NA,NA,NA,NA,513,NA,513,32,481,June,2018
M14 [Patient Services],14.9.1,Inpatient Deaths - Male,TOTAL,268,204,64,13,255,202,202,NA,NA,202,0,0,NA,0,NA,2,2,NA,NA,2,NA,NA,NA,NA,NA,NA,NA,NA,NA,NA,NA,NA,NA,NA,NA,64,NA,64,13,51,June,2018
M14 [Patient Services],14.9.2,Inpatient Deaths - Female,TOTAL,171,119,52,11,160,117,117,NA,NA,117,0,0,NA,0,NA,2,2,NA,NA,2,NA,NA,NA,NA,NA,NA,NA,NA,NA,NA,NA,NA,NA,NA,NA,52,NA,52,11,41,June,2018
M14 [Patient Services],14.1,In-Patient Head Count at midnight,TOTAL,64285,42370,21915,6555,57730,39368,39368,NA,NA,39368,0,0,NA,0,NA,3002,3002,NA,NA,3002,NA,NA,NA,NA,NA,NA,NA,NA,NA,NA,NA,NA,NA,NA,NA,21915,NA,21915,6555,15360,June,2018
M14 [Patient Services],14.11,Number of Admission in NBSU ( New Born Stabilisation Unit),TOTAL,53,0,53,53,0,NA,NA,NA,NA,NA,0,0,NA,0,NA,NA,NA,NA,NA,NA,NA,NA,NA,NA,NA,NA,NA,NA,NA,NA,NA,NA,NA,NA,NA,53,NA,53,53,0,June,2018
M14 [Patient Services],14.12.1,Special Newborn Care Unit (SNCU Admissions) - Inborn Male,TOTAL,53,51,2,2,51,0,0,NA,NA,0,NA,NA,NA,NA,NA,51,51,NA,NA,51,NA,NA,NA,NA,NA,NA,NA,NA,NA,NA,NA,NA,NA,NA,NA,2,NA,2,2,0,June,2018
M14 [Patient Services],14.12.2,Special Newborn Care Unit (SNCU Admissions) - Inborn Female,TOTAL,77,38,39,39,38,NA,NA,NA,NA,NA,NA,NA,NA,NA,NA,38,38,NA,NA,38,NA,NA,NA,NA,NA,NA,NA,NA,NA,NA,NA,NA,NA,NA,NA,39,NA,39,39,0,June,2018
M14 [Patient Services],14.12.3,Outborn – Male,TOTAL,9,8,1,1,8,8,8,NA,NA,8,NA,NA,NA,NA,NA,NA,NA,NA,NA,NA,NA,NA,NA,NA,NA,NA,NA,NA,NA,NA,NA,NA,NA,NA,NA,1,NA,1,1,0,June,2018
M14 [Patient Services],14.12.4,Outborn - Female,TOTAL,8,7,1,1,7,7,7,NA,NA,7,NA,NA,NA,NA,NA,NA,NA,NA,NA,NA,NA,NA,NA,NA,NA,NA,NA,NA,NA,NA,NA,NA,NA,NA,NA,1,NA,1,1,0,June,2018
M14 [Patient Services],14.12.5,Number of newborns admitted in SNCU - referred by ASHA,TOTAL,0,NA,0,0,0,NA,NA,NA,NA,NA,NA,NA,NA,NA,NA,NA,NA,NA,NA,NA,NA,NA,NA,NA,NA,NA,NA,NA,NA,NA,NA,NA,NA,NA,NA,0,NA,0,0,0,June,2018
M14 [Patient Services],14.13,Number of deaths occurring at SNCU,TOTAL,0,0,0,0,0,NA,NA,NA,NA,NA,NA,NA,NA,NA,NA,0,0,NA,NA,0,NA,NA,NA,NA,NA,NA,NA,NA,NA,NA,NA,NA,NA,NA,NA,0,NA,0,0,0,June,2018
M14 [Patient Services],14.14.1,Number of children admitted in NRC,TOTAL,0,0,0,0,0,NA,NA,NA,NA,NA,0,0,NA,0,NA,NA,NA,NA,NA,NA,NA,NA,NA,NA,NA,NA,NA,NA,NA,NA,NA,NA,NA,NA,NA,0,NA,0,0,0,June,2018
M14 [Patient Services],14.14.2,Number of children discharged with target weight gain from the NRCs,TOTAL,0,0,0,0,0,NA,NA,NA,NA,NA,0,0,NA,0,NA,NA,NA,NA,NA,NA,NA,NA,NA,NA,NA,NA,NA,NA,NA,NA,NA,NA,NA,NA,NA,0,NA,0,0,0,June,2018
M14 [Patient Services],14.15,Number of Rogi Kalyan Samiti (RKS) meetings held,TOTAL,0,0,0,0,0,NA,NA,NA,NA,NA,0,0,NA,0,NA,NA,NA,NA,NA,NA,NA,NA,NA,NA,NA,NA,NA,NA,NA,NA,NA,NA,NA,NA,NA,0,NA,0,0,0,June,2018
M14 [Patient Services],14.16,Number of Anganwadi centres/ UPHCs reported to have conducted Village Health & Nutrition Day (VHNDs)/ Urban Health & Nutrition Day (UHNDs)/ Outreach / Special Outreach,TOTAL,25,25,NA,25,NA,NA,NA,NA,NA,NA,0,0,NA,0,NA,15,15,NA,15,NA,NA,NA,NA,NA,NA,NA,NA,NA,NA,NA,10,10,NA,10,NA,NA,NA,NA,NA,NA,June,2018
M14 [Patient Services],14.17,Stock out rate of essential Drugs,TOTAL,0,0,0,NA,0,NA,NA,NA,NA,NA,NA,NA,NA,NA,NA,0,0,NA,NA,0,NA,NA,NA,NA,NA,NA,NA,NA,NA,NA,NA,NA,NA,NA,NA,0,NA,0,NA,0,June,2018
M14 [Patient Services],14.18,Blood Units Issued on replacement (Family Donors to be considered as replacement donations),TOTAL,0,NA,0,NA,0,NA,NA,NA,NA,NA,NA,NA,NA,NA,NA,NA,NA,NA,NA,NA,NA,NA,NA,NA,NA,NA,NA,NA,NA,NA,NA,NA,NA,NA,NA,0,NA,0,NA,0,June,2018
M14 [Patient Services],14.19,Total number of blood units issued in year,TOTAL,112,112,0,NA,112,NA,NA,NA,NA,NA,NA,NA,NA,NA,NA,112,112,NA,NA,112,NA,NA,NA,NA,NA,NA,NA,NA,NA,NA,NA,NA,NA,NA,NA,0,NA,0,NA,0,June,2018
M14 [Patient Services],14.2,Patient Satisfaction Score of the facility in percentage (from Mera Aspatal),TOTAL,57,57,0,NA,57,NA,NA,NA,NA,NA,NA,NA,NA,NA,NA,57,57,NA,NA,57,NA,NA,NA,NA,NA,NA,NA,NA,NA,NA,NA,NA,NA,NA,NA,0,NA,0,NA,0,June,2018
M15 [Laboratory Testing],15.1,Number of Lab Tests done,TOTAL,391003,81623,309380,86472,304531,277,277,NA,NA,277,47,47,NA,47,NA,78451,78451,NA,6698,71753,1392,1392,NA,1392,NA,175,175,NA,175,NA,1281,1281,NA,448,833,309380,NA,309380,77712,231668,June,2018
M15 [Laboratory Testing],15.2.1,Number of Hb tests conducted,TOTAL,26431,7056,19375,9286,17145,106,106,NA,NA,106,47,47,NA,47,NA,6272,6272,NA,1540,4732,219,219,NA,219,NA,92,92,NA,92,NA,320,320,NA,134,186,19375,NA,19375,7254,12121,June,2018
M15 [Laboratory Testing],15.2.2,"Out of the total number of Hb tests done, Number having Hb < 7 mg",TOTAL,412,337,75,102,310,3,3,NA,NA,3,0,0,NA,0,NA,328,328,NA,46,282,4,4,NA,4,NA,NA,NA,NA,NA,NA,2,2,NA,0,2,75,NA,75,52,23,June,2018
M15 [Laboratory Testing],15.3.1.a,Male HIV - Number Tested,TOTAL,2005,572,1433,750,1255,91,91,NA,NA,91,0,0,NA,0,NA,481,481,NA,156,325,NA,NA,NA,NA,NA,NA,NA,NA,NA,NA,NA,NA,NA,NA,NA,1433,NA,1433,594,839,June,2018
M15 [Laboratory Testing],15.3.1.b,Male HIV - Number Positive,TOTAL,17,13,4,7,10,1,1,NA,NA,1,0,0,NA,0,NA,12,12,NA,4,8,NA,NA,NA,NA,NA,NA,NA,NA,NA,NA,NA,NA,NA,NA,NA,4,NA,4,3,1,June,2018
M15 [Laboratory Testing],15.3.2.a,Female Non ANC HIV - Number Tested,TOTAL,1151,511,640,383,768,113,113,NA,NA,113,0,0,NA,0,NA,398,398,NA,186,212,NA,NA,NA,NA,NA,NA,NA,NA,NA,NA,NA,NA,NA,NA,NA,640,NA,640,197,443,June,2018
M15 [Laboratory Testing],15.3.2.b,Female Non ANC HIV - Number Positive,TOTAL,5,2,3,3,2,0,0,NA,NA,0,0,0,NA,0,NA,2,2,NA,1,1,NA,NA,NA,NA,NA,NA,NA,NA,NA,NA,NA,NA,NA,NA,NA,3,NA,3,2,1,June,2018
M15 [Laboratory Testing],15.3.3.a,Number of pregnant women screened for HIV,TOTAL,1304,1182,122,232,1072,34,34,NA,NA,34,0,0,NA,0,NA,930,930,NA,76,854,NA,NA,NA,NA,NA,2,2,NA,2,NA,216,216,NA,54,162,122,NA,122,100,22,June,2018
M15 [Laboratory Testing],15.3.3.b,"Out of the above, number screened positive",TOTAL,7,7,0,0,7,1,1,NA,NA,1,0,0,NA,0,NA,6,6,NA,0,6,NA,NA,NA,NA,NA,NA,NA,NA,NA,NA,0,0,NA,0,0,0,NA,0,0,0,June,2018
M15 [Laboratory Testing],15.3.3.c,"Out of the above number screened positive, number confirmed with HIV infection at Integrated Counselling and Testing Centre (ICTC)",TOTAL,1,1,0,0,1,1,1,NA,NA,1,0,0,NA,0,NA,0,0,NA,0,NA,NA,NA,NA,NA,NA,NA,NA,NA,NA,NA,NA,NA,NA,NA,NA,0,NA,0,0,0,June,2018
M15 [Laboratory Testing],15.3.4.a,Number of Male STI/RTI attendees tested for syphilis,TOTAL,12,0,12,12,0,NA,NA,NA,NA,NA,0,0,NA,0,NA,0,0,NA,0,NA,NA,NA,NA,NA,NA,NA,NA,NA,NA,NA,0,0,NA,0,NA,12,NA,12,12,0,June,2018
M15 [Laboratory Testing],15.3.4.b,Number of Male STI/RTI attendees found sero Positive for syphilis,TOTAL,0,0,0,0,0,NA,NA,NA,NA,NA,0,0,NA,0,NA,0,0,NA,0,NA,NA,NA,NA,NA,NA,NA,NA,NA,NA,NA,0,0,NA,0,NA,0,NA,0,0,0,June,2018
M15 [Laboratory Testing],15.3.4.c,Number of Female (Non ANC)STI/RTI attendees tested for syphilis,TOTAL,26,0,26,26,0,NA,NA,NA,NA,NA,0,0,NA,0,NA,0,0,NA,0,NA,NA,NA,NA,NA,NA,NA,NA,NA,NA,NA,NA,NA,NA,NA,NA,26,NA,26,26,0,June,2018
M15 [Laboratory Testing],15.3.4.d,Number of Female (Non ANC) STI/RTI attendees found sero Positive for syphilis,TOTAL,0,0,0,0,0,NA,NA,NA,NA,NA,0,0,NA,0,NA,0,0,NA,0,NA,NA,NA,NA,NA,NA,NA,NA,NA,NA,NA,NA,NA,NA,NA,NA,0,NA,0,0,0,June,2018
M15 [Laboratory Testing],15.4.1,Widal tests - Number Tested,TOTAL,777,314,463,467,310,NA,NA,NA,NA,NA,0,0,NA,0,NA,314,314,NA,74,240,NA,NA,NA,NA,NA,NA,NA,NA,NA,NA,0,0,NA,0,NA,463,NA,463,393,70,June,2018
M15 [Laboratory Testing],15.4.2,Widal tests - Number Positive,TOTAL,143,57,86,85,58,NA,NA,NA,NA,NA,0,0,NA,0,NA,57,57,NA,3,54,NA,NA,NA,NA,NA,NA,NA,NA,NA,NA,0,0,NA,0,NA,86,NA,86,82,4,June,2018
M15 [Laboratory Testing],15.5.1,Radiology - X-ray,TOTAL,21117,3575,17542,8039,13078,NA,NA,NA,NA,NA,NA,NA,NA,NA,NA,3575,3575,NA,NA,3575,NA,NA,NA,NA,NA,NA,NA,NA,NA,NA,NA,NA,NA,NA,NA,17542,NA,17542,8039,9503,June,2018
M15 [Laboratory Testing],15.5.2,Radiology - Ultrasonography (USG),TOTAL,7948,1149,6799,1152,6796,NA,NA,NA,NA,NA,NA,NA,NA,NA,NA,1149,1149,NA,NA,1149,NA,NA,NA,NA,NA,NA,NA,NA,NA,NA,NA,NA,NA,NA,NA,6799,NA,6799,1152,5647,June,2018
M16 [Details of deaths reported with probable causes:],16.1,Infant deaths within 24 hrs(1 to 23 Hrs) of birth,TOTAL,0,0,0,0,0,NA,NA,NA,NA,NA,0,0,NA,0,NA,0,0,NA,0,NA,NA,NA,NA,NA,NA,NA,NA,NA,NA,NA,NA,NA,NA,NA,NA,0,NA,0,0,0,June,2018
M16 [Details of deaths reported with probable causes:],16.2.1,Infant Deaths up to 4 weeks due to Sepsis,TOTAL,0,0,0,0,0,NA,NA,NA,NA,NA,0,0,NA,0,NA,0,0,NA,0,NA,NA,NA,NA,NA,NA,NA,NA,NA,NA,NA,NA,NA,NA,NA,NA,0,NA,0,0,0,June,2018
M16 [Details of deaths reported with probable causes:],16.2.2,Infant Deaths up to 4 weeks due to Asphyxia,TOTAL,0,0,0,0,0,NA,NA,NA,NA,NA,0,0,NA,0,NA,0,0,NA,0,NA,NA,NA,NA,NA,NA,NA,NA,NA,NA,NA,NA,NA,NA,NA,NA,0,NA,0,0,0,June,2018
M16 [Details of deaths reported with probable causes:],16.2.3,Infant Deaths up to 4 weeks due to Other causes,TOTAL,3,2,1,3,0,NA,NA,NA,NA,NA,0,0,NA,0,NA,0,0,NA,0,NA,NA,NA,NA,NA,NA,NA,NA,NA,NA,NA,2,2,NA,2,NA,1,NA,1,1,0,June,2018
M16 [Details of deaths reported with probable causes:],16.3.1,Number of Infant Deaths (1 -12 months) due to Pneumonia,TOTAL,0,0,0,0,NA,NA,NA,NA,NA,NA,0,0,NA,0,NA,0,0,NA,0,NA,NA,NA,NA,NA,NA,NA,NA,NA,NA,NA,NA,NA,NA,NA,NA,0,NA,0,0,NA,June,2018
M16 [Details of deaths reported with probable causes:],16.3.2,Number of Infant Deaths (1 -12 months) due to Diarrhoea,TOTAL,0,0,0,0,0,NA,NA,NA,NA,NA,0,0,NA,0,NA,0,0,NA,0,NA,NA,NA,NA,NA,NA,NA,NA,NA,NA,NA,NA,NA,NA,NA,NA,0,NA,0,0,0,June,2018
M16 [Details of deaths reported with probable causes:],16.3.3,Number of Infant Deaths (1 -12 months) due to Fever related,TOTAL,0,0,0,0,0,NA,NA,NA,NA,NA,0,0,NA,0,NA,0,0,NA,0,NA,NA,NA,NA,NA,NA,NA,NA,NA,NA,NA,NA,NA,NA,NA,NA,0,NA,0,0,0,June,2018
M16 [Details of deaths reported with probable causes:],16.3.4,Number of Infant Deaths (1 -12 months) due to Measles,TOTAL,0,0,0,0,0,NA,NA,NA,NA,NA,0,0,NA,0,NA,0,0,NA,0,NA,NA,NA,NA,NA,NA,NA,NA,NA,NA,NA,NA,NA,NA,NA,NA,0,NA,0,0,0,June,2018
M16 [Details of deaths reported with probable causes:],16.3.5,Number of Infant Deaths (1 -12 months) due to Others,TOTAL,1,1,0,1,0,NA,NA,NA,NA,NA,0,0,NA,0,NA,0,0,NA,0,NA,NA,NA,NA,NA,NA,NA,NA,NA,NA,NA,1,1,NA,1,NA,0,NA,0,0,0,June,2018
M16 [Details of deaths reported with probable causes:],16.4.1,Number of Child Deaths (1 -5 years) due to Pneumonia,TOTAL,0,0,0,0,0,NA,NA,NA,NA,NA,0,0,NA,0,NA,0,0,NA,0,NA,NA,NA,NA,NA,NA,NA,NA,NA,NA,NA,NA,NA,NA,NA,NA,0,NA,0,0,0,June,2018
M16 [Details of deaths reported with probable causes:],16.4.2,Number of Child Deaths (1 -5 years) due to Diarrhoea,TOTAL,0,0,0,0,0,NA,NA,NA,NA,NA,0,0,NA,0,NA,0,0,NA,0,NA,NA,NA,NA,NA,NA,NA,NA,NA,NA,NA,NA,NA,NA,NA,NA,0,NA,0,0,0,June,2018
M16 [Details of deaths reported with probable causes:],16.4.3,Number of Child Deaths (1 -5 years) due to Fever related,TOTAL,0,0,0,0,0,NA,NA,NA,NA,NA,0,0,NA,0,NA,0,0,NA,0,NA,NA,NA,NA,NA,NA,NA,NA,NA,NA,NA,NA,NA,NA,NA,NA,0,NA,0,0,0,June,2018
M16 [Details of deaths reported with probable causes:],16.4.4,Number of Child Deaths (1 -5 years) due to Measles,TOTAL,0,0,0,0,0,NA,NA,NA,NA,NA,0,0,NA,0,NA,0,0,NA,0,NA,NA,NA,NA,NA,NA,NA,NA,NA,NA,NA,NA,NA,NA,NA,NA,0,NA,0,0,0,June,2018
M16 [Details of deaths reported with probable causes:],16.4.5,Number of Child Deaths (1 -5 years) due to Others,TOTAL,1,0,1,1,0,NA,NA,NA,NA,NA,0,0,NA,0,NA,0,0,NA,0,NA,NA,NA,NA,NA,NA,NA,NA,NA,NA,NA,NA,NA,NA,NA,NA,1,NA,1,1,0,June,2018
M16 [Details of deaths reported with probable causes:],16.5.1,Number of Maternal Deaths due to Bleeding,TOTAL,0,0,0,0,NA,NA,NA,NA,NA,NA,0,0,NA,0,NA,0,0,NA,0,NA,NA,NA,NA,NA,NA,NA,NA,NA,NA,NA,NA,NA,NA,NA,NA,0,NA,0,0,NA,June,2018
M16 [Details of deaths reported with probable causes:],16.5.2,Number of Maternal Deaths due to High fever,TOTAL,0,0,0,0,0,NA,NA,NA,NA,NA,0,0,NA,0,NA,0,0,NA,0,NA,NA,NA,NA,NA,NA,NA,NA,NA,NA,NA,NA,NA,NA,NA,NA,0,NA,0,0,0,June,2018
M16 [Details of deaths reported with probable causes:],16.5.3,Number of Maternal Deaths due to Abortion,TOTAL,0,0,0,0,0,NA,NA,NA,NA,NA,0,0,NA,0,NA,0,0,NA,0,NA,NA,NA,NA,NA,NA,NA,NA,NA,NA,NA,NA,NA,NA,NA,NA,0,NA,0,0,0,June,2018
M16 [Details of deaths reported with probable causes:],16.5.4,Number of Maternal Deaths due to Obstructed/prolonged labour,TOTAL,0,0,0,0,0,NA,NA,NA,NA,NA,0,0,NA,0,NA,0,0,NA,0,NA,NA,NA,NA,NA,NA,NA,NA,NA,NA,NA,NA,NA,NA,NA,NA,0,NA,0,0,0,June,2018
M16 [Details of deaths reported with probable causes:],16.5.5,Number of Maternal Deaths due to Severe hypertesnion/fits,TOTAL,0,0,0,0,0,NA,NA,NA,NA,NA,0,0,NA,0,NA,0,0,NA,0,NA,NA,NA,NA,NA,NA,NA,NA,NA,NA,NA,NA,NA,NA,NA,NA,0,NA,0,0,0,June,2018
M16 [Details of deaths reported with probable causes:],16.5.6,Number of Maternal Deaths due to Other Causes (including causes not known),TOTAL,0,0,0,0,0,NA,NA,NA,NA,NA,0,0,NA,0,NA,0,0,NA,0,NA,NA,NA,NA,NA,NA,NA,NA,NA,NA,NA,NA,NA,NA,NA,NA,0,NA,0,0,0,June,2018
M16 [Details of deaths reported with probable causes:],16.6,Total Facility Based Maternal Death Reviews (FBMDR) done,TOTAL,0,NA,0,0,0,NA,NA,NA,NA,NA,NA,NA,NA,NA,NA,NA,NA,NA,NA,NA,NA,NA,NA,NA,NA,NA,NA,NA,NA,NA,NA,NA,NA,NA,NA,0,NA,0,0,0,June,2018
M16 [Details of deaths reported with probable causes:],16.7.1,Number of Adolscent / Adult deaths due to Diarrhoeal diseases,TOTAL,0,0,0,0,0,NA,NA,NA,NA,NA,0,0,NA,0,NA,0,0,NA,0,NA,NA,NA,NA,NA,NA,NA,NA,NA,NA,NA,NA,NA,NA,NA,NA,0,NA,0,0,0,June,2018
M16 [Details of deaths reported with probable causes:],16.7.2,Number of Adolscent / Adult deaths due to Tuberculosis,TOTAL,3,0,3,3,0,NA,NA,NA,NA,NA,0,0,NA,0,NA,0,0,NA,0,NA,NA,NA,NA,NA,NA,NA,NA,NA,NA,NA,NA,NA,NA,NA,NA,3,NA,3,3,0,June,2018
M16 [Details of deaths reported with probable causes:],16.7.3,Number of Adolscent / Adult deaths due to Respiratory diseases including infections (other than TB),TOTAL,2,0,2,1,1,NA,NA,NA,NA,NA,0,0,NA,0,NA,0,0,NA,0,NA,NA,NA,NA,NA,NA,NA,NA,NA,NA,NA,NA,NA,NA,NA,NA,2,NA,2,1,1,June,2018
M16 [Details of deaths reported with probable causes:],16.7.4,Number of Adolscent / Adult deaths due to Other Fever Related,TOTAL,0,0,0,0,0,NA,NA,NA,NA,NA,0,0,NA,0,NA,0,0,NA,0,NA,NA,NA,NA,NA,NA,NA,NA,NA,NA,NA,NA,NA,NA,NA,NA,0,NA,0,0,0,June,2018
M16 [Details of deaths reported with probable causes:],16.7.5,Number of Adolscent / Adult deaths due to HIV/AIDS,TOTAL,0,0,0,0,0,NA,NA,NA,NA,NA,0,0,NA,0,NA,0,0,NA,0,NA,NA,NA,NA,NA,NA,NA,NA,NA,NA,NA,NA,NA,NA,NA,NA,0,NA,0,0,0,June,2018
M16 [Details of deaths reported with probable causes:],16.7.6,Number of Adolscent / Adult deaths due to Heart disease/Hypertension related,TOTAL,12,2,10,0,12,NA,NA,NA,NA,NA,0,0,NA,0,NA,2,2,NA,0,2,NA,NA,NA,NA,NA,NA,NA,NA,NA,NA,NA,NA,NA,NA,NA,10,NA,10,0,10,June,2018
M16 [Details of deaths reported with probable causes:],16.7.7,Number of Adolscent / Adult deaths due to Cancer,TOTAL,18,0,18,3,15,NA,NA,NA,NA,NA,0,0,NA,0,NA,0,0,NA,0,NA,NA,NA,NA,NA,NA,NA,NA,NA,NA,NA,NA,NA,NA,NA,NA,18,NA,18,3,15,June,2018
M16 [Details of deaths reported with probable causes:],16.7.8,Number of Adolscent / Adult deaths due to Neurological disease including strokes,TOTAL,7,0,7,3,4,NA,NA,NA,NA,NA,0,0,NA,0,NA,0,0,NA,0,NA,NA,NA,NA,NA,NA,NA,NA,NA,NA,NA,NA,NA,NA,NA,NA,7,NA,7,3,4,June,2018
M16 [Details of deaths reported with probable causes:],16.7.9,Number of Adolscent / Adult deaths due to Accidents/Burn cases,TOTAL,0,0,0,0,0,NA,NA,NA,NA,NA,0,0,NA,0,NA,0,0,NA,0,NA,NA,NA,NA,NA,NA,NA,NA,NA,NA,NA,NA,NA,NA,NA,NA,0,NA,0,0,0,June,2018
M16 [Details of deaths reported with probable causes:],16.7.10,Number of Adolscent / Adult deaths due to Suicide,TOTAL,0,0,0,0,0,NA,NA,NA,NA,NA,0,0,NA,0,NA,0,0,NA,0,NA,NA,NA,NA,NA,NA,NA,NA,NA,NA,NA,NA,NA,NA,NA,NA,0,NA,0,0,0,June,2018
M16 [Details of deaths reported with probable causes:],16.7.11,Number of Adolscent / Adult deaths due to Animal bites and stings,TOTAL,0,0,0,0,0,NA,NA,NA,NA,NA,0,0,NA,0,NA,0,0,NA,0,NA,NA,NA,NA,NA,NA,NA,NA,NA,NA,NA,NA,NA,NA,NA,NA,0,NA,0,0,0,June,2018
M16 [Details of deaths reported with probable causes:],16.7.12,Number of Adolscent / Adult deaths due to Known Acute Disease,TOTAL,9,0,9,9,0,NA,NA,NA,NA,NA,0,0,NA,0,NA,0,0,NA,0,NA,NA,NA,NA,NA,NA,NA,NA,NA,NA,NA,NA,NA,NA,NA,NA,9,NA,9,9,0,June,2018
M16 [Details of deaths reported with probable causes:],16.7.13,Number of Adolscent / Adult deaths due to Known Chronic Disease,TOTAL,10,0,10,2,8,NA,NA,NA,NA,NA,0,0,NA,0,NA,0,0,NA,0,NA,NA,NA,NA,NA,NA,NA,NA,NA,NA,NA,NA,NA,NA,NA,NA,10,NA,10,2,8,June,2018
M16 [Details of deaths reported with probable causes:],16.7.14,Number of Adolscent / Adult deaths due to Causes not known,TOTAL,3,3,0,1,2,NA,NA,NA,NA,NA,0,0,NA,0,NA,2,2,NA,0,2,NA,NA,NA,NA,NA,NA,NA,NA,NA,NA,1,1,NA,1,NA,0,NA,0,0,0,June,2018
M16 [Details of deaths reported with probable causes:],16.8.1,Number of Deaths due to Malaria- Plasmodium Vivax,TOTAL,0,0,0,0,0,NA,NA,NA,NA,NA,0,0,NA,0,NA,0,0,NA,0,NA,NA,NA,NA,NA,NA,NA,NA,NA,NA,NA,NA,NA,NA,NA,NA,0,NA,0,0,0,June,2018
M16 [Details of deaths reported with probable causes:],16.8.2,Number of Deaths due to Malaria- Plasmodium Falciparum,TOTAL,0,0,0,0,0,NA,NA,NA,NA,NA,0,0,NA,0,NA,0,0,NA,0,NA,NA,NA,NA,NA,NA,NA,NA,NA,NA,NA,NA,NA,NA,NA,NA,0,NA,0,0,0,June,2018
M16 [Details of deaths reported with probable causes:],16.8.3,Number of Deaths due to Kala Azar,TOTAL,0,0,0,0,0,NA,NA,NA,NA,NA,0,0,NA,0,NA,NA,NA,NA,NA,NA,NA,NA,NA,NA,NA,NA,NA,NA,NA,NA,NA,NA,NA,NA,NA,0,NA,0,0,0,June,2018
M16 [Details of deaths reported with probable causes:],16.8.4,Number of Deaths due to Dengue,TOTAL,0,0,0,0,0,NA,NA,NA,NA,NA,0,0,NA,0,NA,NA,NA,NA,NA,NA,NA,NA,NA,NA,NA,NA,NA,NA,NA,NA,NA,NA,NA,NA,NA,0,NA,0,0,0,June,2018
M16 [Details of deaths reported with probable causes:],16.8.5,Number of Deaths due to Acute Encephelitis Syndrome (AES),TOTAL,0,0,0,0,0,NA,NA,NA,NA,NA,0,0,NA,0,NA,NA,NA,NA,NA,NA,NA,NA,NA,NA,NA,NA,NA,NA,NA,NA,NA,NA,NA,NA,NA,0,NA,0,0,0,June,2018
M16 [Details of deaths reported with probable causes:],16.8.6,Number of Deaths due to Japanese Encephalitis (JE),TOTAL,0,0,0,0,0,NA,NA,NA,NA,NA,0,0,NA,0,NA,NA,NA,NA,NA,NA,NA,NA,NA,NA,NA,NA,NA,NA,NA,NA,NA,NA,NA,NA,NA,0,NA,0,0,0,June,2018
M1 [Ante Natal Care (ANC)],1.1,Total number of pregnant women registered for ANC,TOTAL,3837,2603,1234,2385,1452,284,284,NA,NA,284,13,13,NA,13,NA,1447,1447,NA,670,777,39,39,NA,39,NA,85,85,NA,85,NA,735,735,NA,354,381,1234,NA,1234,1224,10,July,2018
M1 [Ante Natal Care (ANC)],1.1.1,"Out of the total ANC registered, number registered within 1st trimester (within 12 weeks)",TOTAL,1886,1187,699,1207,679,246,246,NA,NA,246,9,9,NA,9,NA,503,503,NA,297,206,5,5,NA,5,NA,59,59,NA,59,NA,365,365,NA,145,220,699,NA,699,692,7,July,2018
M1 [Ante Natal Care (ANC)],1.2.1,Number of PW given TT1,TOTAL,1504,1248,256,937,567,123,123,NA,NA,123,10,10,NA,10,NA,553,553,NA,327,226,19,19,NA,19,NA,58,58,NA,58,NA,485,485,NA,272,213,256,NA,256,251,5,July,2018
M1 [Ante Natal Care (ANC)],1.2.2,Number of PW given TT2,TOTAL,1148,920,228,752,396,87,87,NA,NA,87,8,8,NA,8,NA,412,412,NA,277,135,11,11,NA,11,NA,30,30,NA,30,NA,372,372,NA,202,170,228,NA,228,224,4,July,2018
M1 [Ante Natal Care (ANC)],1.2.3,Number of PW given TT Booster,TOTAL,235,149,86,187,48,0,0,NA,NA,0,0,0,NA,0,NA,76,76,NA,58,18,4,4,NA,4,NA,12,12,NA,12,NA,57,57,NA,27,30,86,NA,86,86,0,July,2018
M1 [Ante Natal Care (ANC)],1.2.4,Number of PW given 180 Iron Folic Acid (IFA) tablets,TOTAL,1609,1171,438,869,740,210,210,NA,NA,210,0,0,NA,0,NA,589,589,NA,210,379,6,6,NA,6,NA,71,71,NA,71,NA,295,295,NA,151,144,438,NA,438,431,7,July,2018
M1 [Ante Natal Care (ANC)],1.2.5,Number of PW given 360 Calcium tablets,TOTAL,1195,813,382,735,460,0,0,NA,NA,0,0,0,NA,0,NA,560,560,NA,181,379,3,3,NA,3,NA,71,71,NA,71,NA,179,179,NA,105,74,382,NA,382,375,7,July,2018
M1 [Ante Natal Care (ANC)],1.2.6,Number of PW given one Albendazole tablet after 1st trimester,TOTAL,613,541,72,273,340,3,3,NA,NA,3,0,0,NA,0,NA,383,383,NA,137,246,0,0,NA,0,NA,30,30,NA,30,NA,125,125,NA,41,84,72,NA,72,65,7,July,2018
M1 [Ante Natal Care (ANC)],1.2.7,Number of PW received 4 or more ANC check ups,TOTAL,2194,1530,664,908,1286,457,457,NA,NA,457,0,0,NA,0,NA,841,841,NA,115,726,11,11,NA,11,NA,35,35,NA,35,NA,186,186,NA,86,100,664,NA,664,661,3,July,2018
M1 [Ante Natal Care (ANC)],1.2.8,Number of PW given ANC Corticosteroids in Pre Term Labour,TOTAL,89,51,38,40,49,NA,NA,NA,NA,NA,0,0,NA,0,NA,49,49,NA,0,49,2,2,NA,2,NA,NA,NA,NA,NA,NA,0,0,NA,0,NA,38,NA,38,38,0,July,2018
M1 [Ante Natal Care (ANC)],1.3.1,New cases of PW with hypertension detected,TOTAL,358,329,29,30,328,21,21,NA,NA,21,0,0,NA,0,NA,307,307,NA,0,307,1,1,NA,1,NA,NA,NA,NA,NA,NA,0,0,NA,0,0,29,NA,29,29,0,July,2018
M1 [Ante Natal Care (ANC)],1.3.1.a,"Out of the new cases of PW with hypertension detected, cases managed at institution",TOTAL,41,21,20,20,21,21,21,NA,NA,21,0,0,NA,0,NA,0,0,NA,0,0,NA,NA,NA,NA,NA,NA,NA,NA,NA,NA,NA,NA,NA,NA,NA,20,NA,20,20,0,July,2018
M1 [Ante Natal Care (ANC)],1.3.2,Number of Eclampsia cases managed during delivery,TOTAL,2,1,1,1,1,1,1,NA,NA,1,0,0,NA,0,NA,0,0,NA,NA,0,NA,NA,NA,NA,NA,NA,NA,NA,NA,NA,NA,NA,NA,NA,NA,1,NA,1,1,0,July,2018
M1 [Ante Natal Care (ANC)],1.4.1,Number of PW tested for Haemoglobin (Hb ) 4 or more than 4 times for respective ANCs,TOTAL,1447,1193,254,405,1042,241,241,NA,NA,241,0,0,NA,0,NA,887,887,NA,110,777,41,41,NA,41,NA,NA,NA,NA,NA,NA,24,24,NA,0,24,254,NA,254,254,0,July,2018
M1 [Ante Natal Care (ANC)],1.4.2,Number of PW having Hb level<11 (tested cases)(7.1 to 10.9),TOTAL,1275,965,310,862,413,71,71,NA,NA,71,0,0,NA,0,NA,484,484,NA,387,97,90,90,NA,90,NA,37,37,NA,37,NA,283,283,NA,38,245,310,NA,310,310,0,July,2018
M1 [Ante Natal Care (ANC)],1.4.3,Number of PW having Hb level<7 (tested cases),TOTAL,271,204,67,176,95,5,5,NA,NA,5,0,0,NA,0,NA,188,188,NA,101,87,8,8,NA,8,NA,NA,NA,NA,NA,NA,3,3,NA,0,3,67,NA,67,67,0,July,2018
M1 [Ante Natal Care (ANC)],1.4.4,Number of PW having severe anaemia (Hb<7) treated,TOTAL,45,44,1,37,8,5,5,NA,NA,5,0,0,NA,0,NA,28,28,NA,28,0,8,8,NA,8,NA,NA,NA,NA,NA,NA,3,3,NA,0,3,1,NA,1,1,0,July,2018
M1 [Ante Natal Care (ANC)],1.5.1,Number of PW tested for blood sugar using OGTT (Oral Glucose Tolerance Test),TOTAL,1346,1022,324,328,1018,241,241,NA,NA,241,0,0,NA,0,NA,781,781,NA,4,777,NA,NA,NA,NA,NA,NA,NA,NA,NA,NA,NA,NA,NA,NA,NA,324,NA,324,324,0,July,2018
M1 [Ante Natal Care (ANC)],1.5.2,Number of PW tested positive for GDM,TOTAL,54,31,23,24,30,30,30,NA,NA,30,0,0,NA,0,NA,1,1,NA,1,0,NA,NA,NA,NA,NA,NA,NA,NA,NA,NA,NA,NA,NA,NA,NA,23,NA,23,23,0,July,2018
M1 [Ante Natal Care (ANC)],1.5.3,Number of PW given insulin out of total tested positive for GDM,TOTAL,14,12,2,2,12,12,12,NA,NA,12,0,0,NA,0,NA,0,0,NA,NA,0,NA,NA,NA,NA,NA,NA,NA,NA,NA,NA,NA,NA,NA,NA,NA,2,NA,2,2,0,July,2018
M1 [Ante Natal Care (ANC)],1.6.1.a,Number of PW tested using POC test for Syphilis,TOTAL,0,0,NA,0,NA,NA,NA,NA,NA,NA,NA,NA,NA,NA,NA,0,0,NA,0,NA,NA,NA,NA,NA,NA,NA,NA,NA,NA,NA,NA,NA,NA,NA,NA,NA,NA,NA,NA,NA,July,2018
M1 [Ante Natal Care (ANC)],1.6.1.b,"Out of above, number of PW found sero positive for syphilis",TOTAL,0,0,NA,0,NA,NA,NA,NA,NA,NA,NA,NA,NA,NA,NA,0,0,NA,0,NA,NA,NA,NA,NA,NA,NA,NA,NA,NA,NA,NA,NA,NA,NA,NA,NA,NA,NA,NA,NA,July,2018
M1 [Ante Natal Care (ANC)],1.6.2.a,Number of pregnant women tested for Syphilis,TOTAL,1595,1433,162,479,1116,241,241,NA,NA,241,0,0,NA,0,NA,1029,1029,NA,252,777,NA,NA,NA,NA,NA,NA,NA,NA,NA,NA,163,163,NA,65,98,162,NA,162,162,0,July,2018
M1 [Ante Natal Care (ANC)],1.6.2.b,Number of pregnant women tested found sero positive for Syphilis,TOTAL,4,0,4,4,0,0,0,NA,NA,0,0,0,NA,0,NA,0,0,NA,0,NA,NA,NA,NA,NA,NA,NA,NA,NA,NA,NA,0,0,NA,0,NA,4,NA,4,4,0,July,2018
M1 [Ante Natal Care (ANC)],1.6.2.c,Number of syphilis positive pregnant women treated for Syphilis,TOTAL,0,0,0,0,0,0,0,NA,NA,0,0,0,NA,0,NA,0,0,NA,0,NA,NA,NA,NA,NA,NA,NA,NA,NA,NA,NA,0,0,NA,0,NA,0,NA,0,0,0,July,2018
M1 [Ante Natal Care (ANC)],1.6.2.d,Number of babies diagnosed with Congenital Syphilis,TOTAL,0,0,0,0,0,0,0,NA,NA,0,0,0,NA,0,NA,0,0,NA,0,NA,NA,NA,NA,NA,NA,NA,NA,NA,NA,NA,NA,NA,NA,NA,NA,0,NA,0,0,0,July,2018
M1 [Ante Natal Care (ANC)],1.6.2.e,Number of babies treated for congenital Syphilis,TOTAL,0,0,0,0,0,0,0,NA,NA,0,0,0,NA,0,NA,0,0,NA,0,NA,NA,NA,NA,NA,NA,NA,NA,NA,NA,NA,NA,NA,NA,NA,NA,0,NA,0,0,0,July,2018
M2 [Deliveries],2.1.1.a,Number of Home Deliveries attended by Skill Birth Attendant(SBA) (Doctor/Nurse/ANM),TOTAL,1,1,NA,1,NA,NA,NA,NA,NA,NA,0,0,NA,0,NA,1,1,NA,1,NA,NA,NA,NA,NA,NA,NA,NA,NA,NA,NA,0,0,NA,0,NA,NA,NA,NA,NA,NA,July,2018
M2 [Deliveries],2.1.1.b,Number of Home Deliveries attended by Non SBA (Trained Birth Attendant(TBA) /Relatives/etc.),TOTAL,72,72,NA,72,NA,NA,NA,NA,NA,NA,0,0,NA,0,NA,29,29,NA,29,NA,NA,NA,NA,NA,NA,12,12,NA,12,NA,31,31,NA,31,NA,NA,NA,NA,NA,NA,July,2018
M2 [Deliveries],2.1.2,Number of PW given Tablet Misoprostol during home delivery,TOTAL,3,3,NA,3,NA,NA,NA,NA,NA,NA,0,0,NA,0,NA,0,0,NA,0,NA,NA,NA,NA,NA,NA,NA,NA,NA,NA,NA,3,3,NA,3,NA,NA,NA,NA,NA,NA,July,2018
M2 [Deliveries],2.1.3,Number of newborns received 7 Home Based Newborn Care (HBNC) visits in case of Home delivery,TOTAL,39,39,NA,39,NA,NA,NA,NA,NA,NA,0,0,NA,0,NA,15,15,NA,15,NA,NA,NA,NA,NA,NA,10,10,NA,10,NA,14,14,NA,14,NA,NA,NA,NA,NA,NA,July,2018
M2 [Deliveries],2.2,Number of Institutional Deliveries conducted (Including C-Sections),TOTAL,1078,628,450,441,637,241,241,NA,NA,241,0,0,NA,0,NA,387,387,NA,0,387,NA,NA,NA,NA,NA,NA,NA,NA,NA,NA,NA,NA,NA,NA,NA,450,NA,450,441,9,July,2018
M2 [Deliveries],2.2.1,Out of total institutional deliveries number of women discharged within 48 hours of delivery,TOTAL,410,219,191,191,219,90,90,NA,NA,90,0,0,NA,0,NA,129,129,NA,0,129,NA,NA,NA,NA,NA,NA,NA,NA,NA,NA,NA,NA,NA,NA,NA,191,NA,191,191,0,July,2018
M2 [Deliveries],2.2.2,Number of newborns received 6 HBNC  visits after Institutional Delivery,TOTAL,493,466,27,493,NA,NA,NA,NA,NA,NA,0,0,NA,0,NA,282,282,NA,282,NA,NA,NA,NA,NA,NA,7,7,NA,7,NA,177,177,NA,177,NA,27,NA,27,27,NA,July,2018
M3 [Number of Caesarean (C-Section) deliveries],3.1,Total C -Section deliveries performed,TOTAL,403,207,196,188,215,151,151,NA,NA,151,0,0,NA,0,NA,56,56,NA,NA,56,NA,NA,NA,NA,NA,NA,NA,NA,NA,NA,NA,NA,NA,NA,NA,196,NA,196,188,8,July,2018
